query,category
My invoice shows a charge for a feature I never used.  Can I get a refund?,Billing Issue
I was overcharged for this month's subscription; the amount is incorrect.,Billing Issue
"The payment went through, but my access is still suspended.  What gives?",Billing Issue
There's a discrepancy between my invoice and the amount charged to my card.,Billing Issue
"I'm being charged a monthly fee, but I cancelled my subscription weeks ago.",Billing Issue
My billing cycle seems to be off; I've been billed twice this month.,Billing Issue
I received an invoice for a service I didn't request. Please clarify.,Billing Issue
"The payment gateway failed, yet I'm still being charged.  This is frustrating.",Billing Issue
I need a refund for the duplicate payment I accidentally made.,Billing Issue
The invoice details are unclear; I can't understand what I'm being charged for.,Billing Issue
I'm being overcharged compared to the advertised price.  I need a resolution.,Billing Issue
My credit card was charged an unexpected fee.  What is this for?,Billing Issue
"I cancelled my subscription, but I'm still receiving invoices.",Billing Issue
I've been charged for a past billing cycle that I've already paid for.,Billing Issue
This is the second time I've had a billing error this month.,Billing Issue
I requested a refund last week and haven't received a response.,Billing Issue
I was charged a higher fee than was stated during my trial period.,Billing Issue
"The system shows my payment as pending, but my bank confirms it went through.",Billing Issue
I need an itemized invoice that clearly explains all charges.,Billing Issue
"My invoice shows a late fee, even though my payment was on time.",Billing Issue
There's a significant discrepancy in the total amount on my invoice.,Billing Issue
"The billing cycle changed without notification, leading to confusion.",Billing Issue
I think there's a glitch in the billing system; my charges are all wrong.,Billing Issue
I was double-charged for the same service.  Please rectify this immediately.,Billing Issue
I need a copy of my receipt showing my payment for this month.,Billing Issue
My account was unexpectedly suspended due to an unpaid invoice.,Billing Issue
The invoice date is incorrect; it shows a payment due date in the past.,Billing Issue
I'm being charged for users that were removed from the account.,Billing Issue
Can I get clarification on the various fees outlined in my invoice?,Billing Issue
My bank statement shows a different amount than my invoice.,Billing Issue
I'm being charged for a higher tier of service than I subscribed to.,Billing Issue
I paid my invoice but it's still showing as unpaid on your system.,Billing Issue
I'm unsure why I'm receiving this invoice; I've never used your service.,Billing Issue
My billing address is incorrect on the invoice. Please update it.,Billing Issue
There's a significant difference between my invoice and my bank statement.,Billing Issue
"I have proof of payment, but your system doesn't show it.",Billing Issue
I contacted customer support last week about billing issues; no response yet.,Billing Issue
"The software stopped working due to a payment issue, even though I paid.",Billing Issue
The currency displayed on my invoice is incorrect.,Billing Issue
I request a detailed breakdown of the charges on my latest invoice.,Billing Issue
I was charged a setup fee that wasn't disclosed during the signup process.,Billing Issue
"My payment method was updated, but the system is still using the old one.",Billing Issue
Why am I being charged for something I specifically opted out of?,Billing Issue
I accidentally selected the wrong billing cycle. Can I adjust this?,Billing Issue
This month's invoice is much higher than previous months.  Why?,Billing Issue
I require an immediate refund for the excessive charges applied.,Billing Issue
I have proof of payment but the system shows a payment failure.,Billing Issue
My payment is clearly visible on my bank statement.  Why is it not recorded?,Billing Issue
The software is still charging me after I deleted my account.,Billing Issue
"My invoice is missing some key details, making it difficult to reconcile.",Billing Issue
I'm experiencing recurring billing issues that need urgent attention.,Billing Issue
This is unacceptable; I expect a prompt resolution to this billing error.,Billing Issue
"I haven't received an invoice yet, though my card has been charged.",Billing Issue
The automated payment failed.  Please clarify the next steps.,Billing Issue
I have a screen recording showing the payment confirmation.,Billing Issue
"My payment was declined, but I never received a notification.",Billing Issue
I need to change my billing information; how can I do this securely?,Billing Issue
There's a missing payment showing on my account summary.,Billing Issue
The invoice total doesn't match the breakdown of charges.,Billing Issue
I've been charged for inactive users; this should be corrected.,Billing Issue
I request a full refund for the entire billing cycle.,Billing Issue
Can you please send me a corrected invoice?,Billing Issue
My subscription should have automatically renewed at a lower price.,Billing Issue
The prorated amount on my invoice is incorrect.,Billing Issue
"I paid through PayPal, but the transaction doesn't show on your system.",Billing Issue
I need to update my credit card information before the next billing cycle.,Billing Issue
"My account was billed twice this month, for the same services.",Billing Issue
Please investigate this billing discrepancy; I'm very concerned.,Billing Issue
I'm being charged for a trial period after cancelling my trial.,Billing Issue
I'm being charged for a service I never agreed to.  This is fraud.,Billing Issue
My billing information is incorrect on file. Please fix this.,Billing Issue
"I've tried paying my invoice multiple times, but it keeps failing.",Billing Issue
I need a written confirmation of my refund request.,Billing Issue
The website shows an incorrect billing status for my account.,Billing Issue
Why am I being charged additional tax? I'm exempt.,Billing Issue
I would like to see a history of all my past invoices.,Billing Issue
I'm concerned about the security of my payment information.,Billing Issue
I canceled my account but am still receiving charges.,Billing Issue
This invoice does not reflect my current subscription level.,Billing Issue
My automatic payment failed; please resend the payment request.,Billing Issue
There's an unexpected charge on my statement; I need to understand why.,Billing Issue
"I requested a prorated refund, but received a full refund instead.",Billing Issue
I'm not sure which invoice this payment refers to.,Billing Issue
"My bank rejected the payment, but I haven't been notified.",Billing Issue
"My subscription is overdue, but I already paid the invoice.",Billing Issue
I'm unable to access the billing portal to view my invoices.,Billing Issue
The system is showing an incorrect balance on my account.,Billing Issue
I need help understanding the charges on my recent invoice.,Billing Issue
I paid via wire transfer; can you confirm receipt of the funds?,Billing Issue
My invoice shows a payment due date that's in the past.,Billing Issue
My credit card expiry date has changed; please update your records.,Billing Issue
"I cancelled my subscription over the phone, but the billing continues.",Billing Issue
The system is showing a different payment method than the one I use.,Billing Issue
I need confirmation that my refund has been processed.,Billing Issue
The billing details on my invoice are incomplete and inaccurate.,Billing Issue
I'm being charged for more users than are actually on my plan.,Billing Issue
I have questions about my invoice; can someone call me?,Billing Issue
I've been overcharged for several months; I need a credit.,Billing Issue
Please provide a breakdown of the VAT included in my invoice.,Billing Issue
There's a problem with my recurring payment; it keeps failing.,Billing Issue
I'm concerned that my payment information might have been compromised.,Billing Issue
The invoice shows incorrect pricing for my subscribed services.,Billing Issue
The invoice amount is significantly higher than expected.,Billing Issue
I request a detailed explanation of these extra fees.,Billing Issue
I haven't used the software but am still being billed.,Billing Issue
I need to change my billing email address.,Billing Issue
I’m being charged even though my contract has ended.,Billing Issue
"My invoice shows an outstanding balance, despite my payment.",Billing Issue
"The payment gateway reported an error, but I'm still charged.",Billing Issue
My subscription status is incorrect; it's showing as inactive.,Billing Issue
I can't access my billing history; this feature is broken.,Billing Issue
I'm receiving incorrect invoices; please fix this immediately.,Billing Issue
I need a clear explanation of the recurring charges on my account.,Billing Issue
I've been charged for a service I've never even heard of.,Billing Issue
I'm experiencing unexpected billing inconsistencies.,Billing Issue
"My trial period ended, but I haven't received an invoice yet.",Billing Issue
The automatic renewal option should have been disabled.,Billing Issue
The charges don't match the agreed-upon pricing in my contract.,Billing Issue
"My account shows a negative balance, which is incorrect.",Billing Issue
I've contacted support multiple times with no resolution.,Billing Issue
There's a significant discrepancy between the expected and actual charges.,Billing Issue
"I need clarification on a charge for ""technical support"" - I never requested it.",Billing Issue
My payment is showing as pending indefinitely.,Billing Issue
There is a problem with the automatic renewal process.,Billing Issue
I accidentally subscribed to the wrong plan and need a refund.,Billing Issue
The invoice doesn't reflect the services I'm currently using.,Billing Issue
"I'm being overcharged for storage, which is below my plan's limit.",Billing Issue
"My payment method has expired, but I haven't received a notification.",Billing Issue
There's a confusing overlap between my current and previous billing cycle.,Billing Issue
The total on my invoice doesn't add up to the individual charges.,Billing Issue
Please investigate this unexpected and unexplained charge.,Billing Issue
I need a confirmation of my payment for invoice number [random number].,Billing Issue
"The software is malfunctioning, yet I'm still being charged.",Billing Issue
I have a dispute with my bank; please investigate my payment status.,Billing Issue
I believe I've been a victim of fraudulent billing activity.,Billing Issue
"My account is locked due to an unpaid invoice, even though I paid.",Billing Issue
I’m requesting a cancellation and a refund for unused services.,Billing Issue
I need help understanding the terms of my billing agreement.,Billing Issue
I'm being charged extra for features included in my plan.,Billing Issue
My invoice is in the wrong currency; it should be in USD.,Billing Issue
The software was unusable for most of the billing cycle.,Billing Issue
I should be receiving a discount based on my contract agreement.,Billing Issue
"My payment was successfully processed, but it's still marked as unpaid.",Billing Issue
The prorated amount for my cancelled subscription is inaccurate.,Billing Issue
"My invoice is missing essential details, like the date of service.",Billing Issue
I haven't been able to access my account due to billing issues.,Billing Issue
The billing system has been consistently unreliable this month.,Billing Issue
I paid a larger amount than the invoice requested.  I need the overpayment returned.,Billing Issue
I request assistance in understanding the billing details of my account.,Billing Issue
My invoice showed a recurring fee I didn't authorize.  Please investigate.,Billing Issue
I was charged twice for the same billing cycle.  Need a refund ASAP.,Billing Issue
There's a discrepancy between my payment and the invoice amount.,Billing Issue
I'm being overcharged; my subscription plan doesn't justify this fee.,Billing Issue
The invoice doesn't match what I agreed to in my contract.,Billing Issue
"My payment clearly went through, but it's marked as unpaid.",Billing Issue
"I canceled my subscription, but I'm still being charged.",Billing Issue
This month's invoice is significantly higher than usual – why?,Billing Issue
I haven't received an invoice this month.,Billing Issue
The billing cycle seems to be off; I was charged early.,Billing Issue
I requested a refund two weeks ago and haven't heard back.,Billing Issue
My credit card was charged an unexpected late fee.,Billing Issue
The invoice is unclear; I can't figure out what I'm paying for.,Billing Issue
I'm being overcharged for features I don't use.,Billing Issue
My payment method is incorrect on the invoice.,Billing Issue
I was charged for a trial period after I canceled it.,Billing Issue
Can you clarify the extra charges on my latest invoice?,Billing Issue
I need a breakdown of the different fees on my invoice.,Billing Issue
"The automated payment failed, but I made the payment manually.",Billing Issue
I'm experiencing a billing error and need assistance.,Billing Issue
My invoice shows a different amount than my bank statement.,Billing Issue
I believe there's a processing error on my payment.,Billing Issue
I'm being charged for a service I never used.,Billing Issue
The invoice is missing crucial information.,Billing Issue
Could you please send me a copy of my invoice?,Billing Issue
I think I've been double-billed this month.,Billing Issue
There's a significant discrepancy in my billing statement.,Billing Issue
I need a detailed explanation of the charges on my account.,Billing Issue
"I contacted support, but my billing issue remains unresolved.",Billing Issue
The billing system seems to have a glitch.,Billing Issue
I was charged for a service that was down for days.,Billing Issue
"My payment was declined, but I've resolved the issue.",Billing Issue
I need to update my payment information.,Billing Issue
Can you provide a prorated refund for my cancellation?,Billing Issue
The invoice is difficult to understand.,Billing Issue
I'm having trouble accessing my billing history.,Billing Issue
I received an error message when trying to make a payment.,Billing Issue
Why am I being charged a setup fee again?,Billing Issue
My subscription should have renewed at a lower rate.,Billing Issue
There's an unexpected charge for additional users.,Billing Issue
"I cancelled my account, but I’m still getting invoices.",Billing Issue
I'm unsure why I've been charged this extra fee.,Billing Issue
This month's invoice is much higher than expected.,Billing Issue
I need to change my billing address.,Billing Issue
Please investigate a potential billing error on my account.,Billing Issue
"My account is showing an outstanding balance, which is incorrect.",Billing Issue
I’ve been charged for a feature I didn’t select.,Billing Issue
My payment failed due to a bank error.,Billing Issue
I'm confused by the charges on my recent invoice.,Billing Issue
"I requested a change to my billing cycle, but it hasn't been updated.",Billing Issue
The invoice shows an incorrect number of users.,Billing Issue
I need a pro-rata refund for the unused portion of my subscription.,Billing Issue
My credit card was charged without my authorization.,Billing Issue
The billing details on the invoice are incorrect.,Billing Issue
I'm unable to download my invoice.,Billing Issue
Please confirm my payment has been received.,Billing Issue
I'm being charged for a service that's not working correctly.,Billing Issue
My invoice is missing line items.,Billing Issue
I need help understanding my billing statement.,Billing Issue
I'm experiencing recurring billing errors.,Billing Issue
There's a problem with my automatic payment.,Billing Issue
The invoice date is incorrect.,Billing Issue
Could you resend my invoice?,Billing Issue
I was wrongly charged a late fee.,Billing Issue
I received a duplicate invoice.,Billing Issue
My billing cycle has changed without my consent.,Billing Issue
I requested a refund but it hasn't been processed.,Billing Issue
My bank statement doesn't match the invoice amount.,Billing Issue
Can you explain the different pricing tiers?,Billing Issue
I'm disputing the charges on my last invoice.,Billing Issue
I need clarification on the additional charges.,Billing Issue
I believe I've been overbilled for this month.,Billing Issue
There's a discrepancy between the invoice and my agreement.,Billing Issue
The total amount due on my invoice is incorrect.,Billing Issue
My payment hasn't been credited to my account.,Billing Issue
I'm having trouble paying my invoice online.,Billing Issue
The support team couldn't resolve my billing issue.,Billing Issue
I was charged extra for storage I didn't use.,Billing Issue
I'm being charged for users that have left the company.,Billing Issue
Can you adjust the billing cycle to match my request?,Billing Issue
The billing system is showing an incorrect account balance.,Billing Issue
I think there might be a bug in your billing system.,Billing Issue
I need to update my payment method for future invoices.,Billing Issue
My invoice is for the wrong amount.,Billing Issue
I've already paid this invoice.,Billing Issue
The late fee is excessive.,Billing Issue
There's an error on my invoice.,Billing Issue
The invoice doesn't match my contract.,Billing Issue
I’m being double-billed for this service.,Billing Issue
My payment has been pending for too long.,Billing Issue
I’m having difficulty downloading my invoice.,Billing Issue
The invoice total is inaccurate.,Billing Issue
I haven’t received an invoice in several months.,Billing Issue
There’s an unexplained charge on my account.,Billing Issue
I'm concerned about unauthorized charges.,Billing Issue
Please clarify the charges on this invoice.,Billing Issue
My payment was processed but not applied to my account.,Billing Issue
The billing cycle is confusing.,Billing Issue
I need assistance understanding my billing.,Billing Issue
The system is incorrectly charging me for deleted users.,Billing Issue
I need to update my billing contact information.,Billing Issue
I think I've been wrongly charged for an upgrade.,Billing Issue
My account is showing the wrong billing date.,Billing Issue
There's a large discrepancy in the charges.,Billing Issue
I need a breakdown of all fees and charges.,Billing Issue
My invoice shows an incorrect currency.,Billing Issue
The invoice is unclear and confusing.,Billing Issue
I need a detailed explanation of the billing error.,Billing Issue
"My subscription ended, but I'm still being billed.",Billing Issue
I'm being charged for a feature I didn't request.,Billing Issue
My payment information was entered incorrectly.,Billing Issue
Please confirm the amount due on this invoice.,Billing Issue
I'm requesting a refund for the overcharge.,Billing Issue
The invoice date doesn't align with the billing cycle.,Billing Issue
I'm experiencing issues with the online payment system.,Billing Issue
The invoice lacks important details.,Billing Issue
There’s a problem with my automatic payment setup.,Billing Issue
I request a refund for the incorrect charges.,Billing Issue
The system is charging me for an inactive user.,Billing Issue
My payment should be reflected on my account.,Billing Issue
I'm disputing this invoice.,Billing Issue
I need help resolving my billing discrepancies.,Billing Issue
The billing statement is difficult to interpret.,Billing Issue
I need a new invoice with the correct information.,Billing Issue
I've made multiple payment attempts without success.,Billing Issue
The charges on this invoice are unexpected.,Billing Issue
I require an explanation of the additional fees.,Billing Issue
I'm requesting a full refund.,Billing Issue
I'm concerned about possible fraud.,Billing Issue
My billing information needs to be corrected.,Billing Issue
There is an error in the invoice amount.,Billing Issue
I'm unsure why I’m being charged for this.,Billing Issue
This invoice is not accurate.,Billing Issue
The billing system has malfunctioned.,Billing Issue
I’m having issues accessing my billing account.,Billing Issue
My automatic payment is failing repeatedly.,Billing Issue
I need to speak with someone about my billing.,Billing Issue
There is a discrepancy in the dates on my invoice.,Billing Issue
I'm requesting a credit for the overcharge.,Billing Issue
My invoice seems to be duplicated.,Billing Issue
The billing cycle is inconsistent.,Billing Issue
I need help understanding this charge.,Billing Issue
The payment processor declined my transaction.,Billing Issue
My card was charged an incorrect amount.,Billing Issue
I'm confused by the billing terms.,Billing Issue
I request an updated invoice immediately.,Billing Issue
I'm concerned about unexpected charges.,Billing Issue
I need a clarification on my account balance.,Billing Issue
I’ve been wrongly charged for a cancelled service.,Billing Issue
My credit card statement shows different charges.,Billing Issue
There's a significant discrepancy between my payment and the invoice.,Billing Issue
The invoice total is higher than my subscription cost.,Billing Issue
I’m requesting a refund for the incorrect billing.,Billing Issue
The system isn't reflecting my payment.,Billing Issue
"My payment has been processed, but the invoice remains unpaid.",Billing Issue
I need help resolving a billing issue.,Billing Issue
The invoice number is incorrect.,Billing Issue
I'm being overcharged for storage.,Billing Issue
My invoice shows a recurring fee I didn't authorize.  Please investigate.,Billing Issue
I was overcharged for this month's billing cycle; the amount is significantly higher than usual.,Billing Issue
There's a discrepancy between my payment and what's reflected on my invoice.,Billing Issue
I requested a refund last week and haven't received it yet.,Billing Issue
"The invoice is unclear, I can't understand what I'm being charged for.",Billing Issue
My credit card was charged twice this month.,Billing Issue
"I cancelled my subscription last month, yet I'm still being billed.",Billing Issue
I'm being charged a setup fee I was told was waived.,Billing Issue
The billing cycle seems to have shifted without notification.,Billing Issue
The invoice doesn't match the terms of my contract.,Billing Issue
I paid via bank transfer but it hasn't been credited to my account.,Billing Issue
Why am I being charged for a feature I didn't use?,Billing Issue
"My payment was processed, but my account still shows an outstanding balance.",Billing Issue
I'm disputing the late payment fee; I paid on time.,Billing Issue
The invoice date is incorrect.,Billing Issue
I need a detailed breakdown of the charges.,Billing Issue
I was charged for a trial period after it ended.,Billing Issue
This month's billing is ridiculously high.,Billing Issue
Can you explain the increase in monthly fees?,Billing Issue
I've been overcharged for three consecutive months.,Billing Issue
"My payment method was updated, but the old card was still charged.",Billing Issue
I haven't received an invoice this month.,Billing Issue
There's a mysterious extra charge on my invoice.,Billing Issue
The billing address on the invoice is wrong.,Billing Issue
The currency on the invoice is incorrect.,Billing Issue
I believe there's a billing error on my account.,Billing Issue
Could you please resend my invoice?,Billing Issue
My subscription renewal should have been lower than this.,Billing Issue
I'm requesting a full refund for this service.,Billing Issue
"I contacted support, but no one could resolve the billing issue.",Billing Issue
The amount charged exceeds the agreed-upon price.,Billing Issue
"My invoice shows a partial payment, but I paid in full.",Billing Issue
I'm confused by the charges on my recent invoice.,Billing Issue
I need help understanding my monthly statement.,Billing Issue
I'm being billed for a service I never used.,Billing Issue
"The payment gateway showed an error, but my card was charged.",Billing Issue
This billing system is very confusing.,Billing Issue
"I requested a pro-rated refund, but was given a full refund.",Billing Issue
This is unacceptable.  I'm being significantly overcharged.,Billing Issue
"I paid the invoice, but it still shows as unpaid.",Billing Issue
The invoice number is missing.,Billing Issue
I cannot access my invoice online.,Billing Issue
My previous payment hasn't been reflected on my account yet.,Billing Issue
The billing system is down.,Billing Issue
I'm unable to download my invoice.,Billing Issue
Can you adjust the billing cycle to match my preference?,Billing Issue
I'm experiencing recurring billing issues with your software.,Billing Issue
The support team was unhelpful with my billing inquiry.,Billing Issue
The invoice lacks crucial details for accounting purposes.,Billing Issue
I'm being double-billed for the same service.,Billing Issue
There's a discrepancy in the tax amount on the invoice.,Billing Issue
I accidentally paid twice.  Please refund the duplicate payment.,Billing Issue
The total on my invoice doesn't match the itemized charges.,Billing Issue
I need an itemized list of the fees charged.,Billing Issue
My bank statement shows a different amount than the invoice.,Billing Issue
"I was promised a discount, but it wasn't applied to my invoice.",Billing Issue
"I canceled my subscription, and yet I am still being billed.  Please rectify this.",Billing Issue
"The software was faulty, yet I am still being billed.  A refund is in order.",Billing Issue
The billing is complicated and unclear.,Billing Issue
I'm unsure what I am being charged for.,Billing Issue
This is frustrating; I've contacted support multiple times.,Billing Issue
The customer service regarding billing is abysmal.,Billing Issue
I am disputing this charge.  This is not accurate.,Billing Issue
