query,category
Please confirm that my payment was applied.,Billing Issue
The system is not processing my payments correctly.,Billing Issue
I'm receiving duplicate invoices.,Billing Issue
I was charged for a feature that's supposed to be included in my plan.,Billing Issue
The charges are not transparent or clear.,Billing Issue
My subscription hasn't been activated despite payment.,Billing Issue
"I paid in full, but the system still shows an outstanding balance.",Billing Issue
The billing statement doesn't show my payment history.,Billing Issue
I believe there's a problem with the billing software.,Billing Issue
I'm requesting a refund for a double charge.,Billing Issue
The invoice doesn't include the correct tax rate.,Billing Issue
I'm unable to make a payment through the online portal.,Billing Issue
The payment gateway is not working correctly.,Billing Issue
I'm experiencing difficulties accessing my billing records.,Billing Issue
My payment method needs to be updated immediately.,Billing Issue
The invoice is not itemized appropriately.,Billing Issue
I haven't received a confirmation of my payment.,Billing Issue
The refund hasn't been processed yet.,Billing Issue
There's a discrepancy between my statement and the invoice.,Billing Issue
I'm being charged a higher rate than agreed upon.,Billing Issue
The billing period has changed without notice.,Billing Issue
My account is locked due to an outstanding payment.,Billing Issue
I'm unsure how to view my current billing statement.,Billing Issue
I requested a refund several times but haven't received it.,Billing Issue
There's a significant difference between the invoice and my usage.,Billing Issue
I need help understanding the charges on my invoice.,Billing Issue
"My payment has been rejected, and I need to know why.",Billing Issue
The invoice number is incorrect.,Billing Issue
The invoice is illegible.,Billing Issue
I have already paid this invoice.,Billing Issue
My account is incorrectly linked to another account.,Billing Issue
The system is showing inaccurate usage data.,Billing Issue
The late payment fee is unreasonable.,Billing Issue
I'm unable to print my invoice.,Billing Issue
I'm experiencing errors when attempting to pay online.,Billing Issue
I need to download a copy of my latest invoice.,Billing Issue
I'm requesting a credit for service interruption.,Billing Issue
The currency on the invoice is incorrect.,Billing Issue
"My payment has failed, but I've already tried to fix it.",Billing Issue
I'm being charged interest on a payment I made on time.,Billing Issue
There are multiple charges for the same service.,Billing Issue
The invoice total is significantly incorrect.,Billing Issue
I require assistance in updating my payment information.,Billing Issue
I'm not receiving billing notifications.,Billing Issue
"The software is frequently malfunctioning, affecting billing.",Billing Issue
The billing terms have changed unexpectedly.,Billing Issue
The invoice lacks sufficient detail.,Billing Issue
My invoice doesn't reflect recent changes to my plan.,Billing Issue
I'm being overcharged for services I didn't use.,Billing Issue
The refund process is too complicated.,Billing Issue
"My payment is showing as pending, but it's been processed.",Billing Issue
I'm experiencing problems accessing my billing account.,Billing Issue
The invoice total is inaccurate.,Billing Issue
The invoice is unclear and difficult to understand.,Billing Issue
I'm being billed for an inactive account.,Billing Issue
I'm experiencing repeated payment failures.,Billing Issue
The billing cycle has changed without my consent.,Billing Issue
My payment has been lost in the system.,Billing Issue
I am receiving conflicting information about my bill.,Billing Issue
The invoice lacks critical information.,Billing Issue
My payment method needs to be changed urgently.,Billing Issue
I'm requesting a revised invoice.,Billing Issue
The overcharge is unacceptable.,Billing Issue
I need a breakdown of all charges on the invoice.,Billing Issue
"I'm receiving inaccurate usage reports, causing incorrect billing.",Billing Issue
The billing system is consistently unreliable.,Billing Issue
I'm having trouble understanding the billing structure.,Billing Issue
The invoice doesn't reflect the discount I should have received.,Billing Issue
I'm requesting a reconciliation of my account.,Billing Issue
I was charged for a service that was not delivered.,Billing Issue
The automated payment system is faulty.,Billing Issue
My bank statement shows a different transaction amount.,Billing Issue
I'm unable to resolve this billing issue on my own.,Billing Issue
The billing support is unhelpful and unresponsive.,Billing Issue
The invoice formatting is poor and unreadable.,Billing Issue
My subscription has been terminated incorrectly.,Billing Issue
The billing details are incorrect.,Billing Issue
The fees are excessive and unreasonable.,Billing Issue
I'm unable to locate my invoice online.,Billing Issue
I need a prompt resolution to this billing dispute.,Billing Issue
I'm concerned about the accuracy of my billing statements.,Billing Issue
I'm being overcharged due to a billing error.,Billing Issue
My payment was successfully processed but not applied to my account.,Billing Issue
There's a major discrepancy on my current billing statement.,Billing Issue
I'm facing consistent billing problems.,Billing Issue
I'm requesting immediate action to resolve this billing issue.,Billing Issue
The invoice details are incomplete.,Billing Issue
I need a confirmation of my refund request.,Billing Issue
The billing system needs significant improvement.,Billing Issue
I'm frustrated with the inconsistent billing.,Billing Issue
I'm experiencing payment processing errors repeatedly.,Billing Issue
My invoice shows a negative balance.,Billing Issue
The invoice is confusing and hard to interpret.,Billing Issue
My account needs urgent attention regarding a billing error.,Billing Issue
I'm requesting a prompt refund for an overcharge.,Billing Issue
The billing department is not responsive to my inquiries.,Billing Issue
I'm requesting clarification on several unclear charges.,Billing Issue
The billing cycle is not working properly.,Billing Issue
I'm experiencing difficulties with the online payment system.,Billing Issue
I need assistance accessing my billing information.,Billing Issue
The payment hasn't been applied to my account.,Billing Issue
The invoice does not reflect my payment.,Billing Issue
I'm being incorrectly charged for a previous billing period.,Billing Issue
I'm having trouble updating my credit card information.,Billing Issue
I'm receiving invoices for services I haven't used.,Billing Issue
The recurring payment is not working correctly.,Billing Issue
My invoice is not generating properly.,Billing Issue
I'm receiving inconsistent statements regarding my billing.,Billing Issue
I need immediate assistance with a critical billing error.,Billing Issue
My billing information is missing key details.,Billing Issue
I'm unsure how to resolve this billing discrepancy.,Billing Issue
I'm experiencing regular issues with my billing.,Billing Issue
The billing system is difficult to use.,Billing Issue
My payment has been rejected due to a system error.,Billing Issue
I'm receiving duplicate billing statements.,Billing Issue
The billing terms and conditions are unclear.,Billing Issue
The invoice doesn't match the services provided.,Billing Issue
I need urgent assistance with my billing problem.,Billing Issue
I'm unable to view my billing history online.,Billing Issue
The billing software is constantly crashing.,Billing Issue
I'm requesting a detailed explanation of all fees.,Billing Issue
The overcharge needs immediate attention.,Billing Issue
The billing process is opaque and inefficient.,Billing Issue
I require a timely resolution to this billing problem.,Billing Issue
"My payment was processed, but the system shows it as failed.",Billing Issue
The invoice is missing crucial information.,Billing Issue
The billing system is unreliable and inconsistent.,Billing Issue
I'm requesting a full refund for the overcharged amount.,Billing Issue
I am unhappy with the billing process.,Billing Issue
I need a simplified billing explanation.,Billing Issue
I'm requesting an immediate review of my billing account.,Billing Issue
The billing system is not user-friendly.,Billing Issue
I'm having trouble understanding my bill.,Billing Issue
I'm receiving bills for services I have cancelled.,Billing Issue
My payment has not been credited to my account.,Billing Issue
The billing is inconsistent and confusing.,Billing Issue
I need help with my billing statement.,Billing Issue
I'm experiencing payment processing errors.,Billing Issue
I'm requesting an adjustment to my bill.,Billing Issue
I'm concerned about unexpected charges.,Billing Issue
The billing system is not functioning correctly.,Billing Issue
I require assistance with understanding the billing details.,Billing Issue
I need to resolve this billing issue urgently.,Billing Issue
The invoice amount is incorrect.,Billing Issue
My payment hasn't been reflected on the invoice.,Billing Issue
I need clarification on this billing issue.,Billing Issue
The billing cycle is irregular.,Billing Issue
I'm receiving conflicting invoices.,Billing Issue
The billing system is very difficult to use.,Billing Issue
I'm having payment issues.,Billing Issue
I'm requesting a refund for a double billing.,Billing Issue
The billing process is inefficient.,Billing Issue
I'm concerned about inaccurate charges.,Billing Issue
I need help with my billing.,Billing Issue
I'm requesting a review of my billing statement.,Billing Issue
I'm experiencing issues with online payments.,Billing Issue
The invoice is inaccurate.,Billing Issue
I'm unhappy with the billing system.,Billing Issue
I need assistance with my billing.,Billing Issue
I'm requesting a refund.,Billing Issue
I'm having billing problems.,Billing Issue
The billing process is confusing.,Billing Issue
"The software crashed during a crucial data import, resulting in significant data loss.  We lost hours of work.",Technical Problem
"I keep getting a ""database connection failed"" error code; it's making the system unusable.",Technical Problem
Slow performance is crippling our workflow; reports take ages to generate.,Technical Problem
"The API integration with our CRM is failing intermittently, causing duplicate entries.",Technical Problem
There's a glitch in the user interface that prevents us from accessing certain features.,Technical Problem
"The software randomly freezes, requiring a full system reboot.  It's incredibly frustrating.",Technical Problem
We're experiencing an integration failure with our payment gateway.,Technical Problem
The update introduced a bug that's preventing us from logging in.,Technical Problem
"The software is unresponsive for extended periods, making it nearly impossible to work.",Technical Problem
"Error code 404 keeps popping up, blocking access to important data.",Technical Problem
"The system crashed during peak hours, causing major disruptions to our business.",Technical Problem
"We're seeing extremely slow performance, especially during report generation.",Technical Problem
This new update has created a massive bug affecting our entire workflow.,Technical Problem
"The user interface is clunky and confusing, leading to errors.",Technical Problem
"The API documentation is severely lacking, making integration difficult.",Technical Problem
"I'm getting a persistent ""access denied"" error, despite having the correct permissions.",Technical Problem
The software's slow performance is impacting our productivity significantly.,Technical Problem
There's a major glitch in the reporting module; the numbers are completely wrong.,Technical Problem
The integration with our email marketing platform is failing completely.,Technical Problem
The system keeps crashing whenever we try to process large datasets.,Technical Problem
We're experiencing constant connectivity issues.  It's unusable.,Technical Problem
The software is incredibly buggy; it's filled with unexpected errors.,Technical Problem
The database is constantly throwing errors; backups are essential.,Technical Problem
Slow performance is a daily issue. It's really slowing us down.,Technical Problem
Our team is experiencing intermittent API connection failures.,Technical Problem
The new update broke the existing functionality.  We need a rollback.,Technical Problem
This software is a nightmare; it constantly freezes and crashes.,Technical Problem
I'm getting a mysterious error code that the support team can't explain.,Technical Problem
The user interface is completely unresponsive; I can't do anything.,Technical Problem
The integration with our inventory system is causing problems.,Technical Problem
"The software crashed mid-transaction, potentially causing financial losses.",Technical Problem
The reporting features are riddled with bugs and inaccuracies.,Technical Problem
We're experiencing extremely slow download speeds.,Technical Problem
The system is completely unresponsive; I've tried everything.,Technical Problem
There's a significant bug in the calculation module.,Technical Problem
The software is constantly throwing error messages.,Technical Problem
It's incredibly frustrating how slow this software is.,Technical Problem
"The API is poorly documented, making it hard to implement.",Technical Problem
"The software crashed unexpectedly, losing all unsaved progress.",Technical Problem
The integration with our ERP is a complete disaster.,Technical Problem
There's a glitch in the search function that prevents us from finding data.,Technical Problem
"We are constantly receiving error messages, rendering the software useless.",Technical Problem
"The software is extremely slow and sluggish, affecting productivity.",Technical Problem
I'm experiencing an API authentication failure.,Technical Problem
The user interface is outdated and difficult to navigate.,Technical Problem
The software frequently crashes during large file uploads.,Technical Problem
We're seeing major performance issues after the recent update.,Technical Problem
"The database is corrupted, causing data loss.",Technical Problem
The software is completely unresponsive during peak usage times.,Technical Problem
There's a bug that prevents us from exporting data.,Technical Problem
The software crashed and I lost all my work. It's unacceptable.,Technical Problem
The API documentation is unclear and unhelpful.,Technical Problem
Constant error messages are disrupting our workflow.,Technical Problem
"The software is extremely slow, even with high-end hardware.",Technical Problem
We are having problems integrating this software with our existing systems.,Technical Problem
The system crashed and we lost a day's worth of work.,Technical Problem
There is a serious bug in the calculation module that is producing inaccurate results.,Technical Problem
The software is buggy and unreliable.,Technical Problem
The software is constantly freezing and locking up.,Technical Problem
"It's extremely slow, even on a fast computer.",Technical Problem
The API is difficult to use.,Technical Problem
The integration failed and we lost data.,Technical Problem
There are frequent errors that are hard to troubleshoot.,Technical Problem
The software is unusable due to persistent crashes.,Technical Problem
It is incredibly slow and frustrating to use.,Technical Problem
The API response times are unacceptable.,Technical Problem
We are experiencing consistent integration failures.,Technical Problem
The software is constantly throwing error codes.,Technical Problem
The user interface is clunky and unintuitive.,Technical Problem
It's a buggy mess and needs a complete overhaul.,Technical Problem
The software crashed while I was working on an important project.,Technical Problem
There's a glitch in the reporting that's causing inaccurate figures.,Technical Problem
The software is extremely slow and inefficient.,Technical Problem
The API is poorly designed and difficult to integrate.,Technical Problem
Constant errors are making it hard to get work done.,Technical Problem
The software crashed and we lost all our unsaved data.,Technical Problem
The system is extremely unstable and prone to crashes.,Technical Problem
"The software is painfully slow, even on a powerful server.",Technical Problem
We're having serious issues with API integration.,Technical Problem
The user interface is so bad it's hard to use.,Technical Problem
The system is constantly throwing errors and warnings.,Technical Problem
"It's slow, buggy, and frustrating to use.  We need a better solution.",Technical Problem
"The software crashed during a critical process, causing delays.",Technical Problem
"The API is not well documented, making it difficult to work with.",Technical Problem
We're experiencing frequent integration failures with our other software.,Technical Problem
The user interface is confusing and difficult to learn.,Technical Problem
The software's slow performance is impacting our ability to meet deadlines.,Technical Problem
There's a serious bug in the payroll module.,Technical Problem
"The software keeps crashing, and we're losing valuable work time.",Technical Problem
We're encountering consistent errors when trying to access data.,Technical Problem
"The system is incredibly slow, even with minimal data.",Technical Problem
The API is not user-friendly and lacks proper documentation.,Technical Problem
The integration with our accounting software is problematic.,Technical Problem
The software is full of bugs and glitches.,Technical Problem
The software crashed and corrupted our database.,Technical Problem
The user interface is awkward and difficult to navigate.,Technical Problem
The slow performance is impacting our productivity.,Technical Problem
The API integration is failing repeatedly.,Technical Problem
The software is constantly crashing and freezing.,Technical Problem
Error messages are appearing constantly.,Technical Problem
The software is incredibly buggy and unreliable.,Technical Problem
There's a significant glitch in the invoice generation process.,Technical Problem
The software is extremely slow and unresponsive.,Technical Problem
The API is poorly documented and hard to use.,Technical Problem
The integration with our CRM system is causing issues.,Technical Problem
"The software is constantly crashing, causing data loss.",Technical Problem
The user interface needs a major overhaul.,Technical Problem
"The software is slow, buggy, and unreliable.",Technical Problem
"It keeps crashing, making it impossible to use.",Technical Problem
The API is inconsistent and unreliable.,Technical Problem
We're experiencing constant integration failures.,Technical Problem
The software is riddled with errors.,Technical Problem
It's painfully slow and frustrating.,Technical Problem
The API is difficult to implement.,Technical Problem
The integration with our existing systems is problematic.,Technical Problem
The software crashed and I lost all of my unsaved work.,Technical Problem
The user interface is confusing and counterintuitive.,Technical Problem
The slow performance is hindering our progress.,Technical Problem
The API is poorly designed and lacking in functionality.,Technical Problem
The software is unreliable and prone to crashes.,Technical Problem
"It's slow, buggy, and a general headache.",Technical Problem
The API keys are not working correctly.,Technical Problem
"The integration is failing, and we're losing data.",Technical Problem
The software is constantly throwing up error messages.,Technical Problem
It's frustratingly slow and unresponsive.,Technical Problem
The API is poorly documented and hard to understand.,Technical Problem
The integration with our payment processor is failing.,Technical Problem
The software crashes frequently and unexpectedly.,Technical Problem
The user interface is outdated and difficult to use.,Technical Problem
"The software is slow, unreliable, and full of bugs.",Technical Problem
It's a constant source of frustration.  It needs fixing.,Technical Problem
"The software keeps crashing randomly, no error code, just shuts down.",Technical Problem
"Slow performance is a major issue, especially during peak hours.",Technical Problem
Integration failure with our CRM is preventing data synchronization.,Technical Problem
Received a cryptic error code 404 every time I try to access reports.,Technical Problem
The API documentation is terrible; impossible to integrate with our system.,Technical Problem
Unresponsive interface after uploading a large file.  It just freezes.,Technical Problem
This bug makes it impossible to edit existing client profiles.,Technical Problem
Frequent glitches are disrupting workflow and costing us valuable time.,Technical Problem
The software crashed during a critical update.  Data loss is a concern.,Technical Problem
Slow performance makes it nearly unusable; needs optimization.,Technical Problem
Error code 123 keeps popping up when I try to generate invoices.,Technical Problem
Integration with our accounting software is failing repeatedly.,Technical Problem
Unresponsive customer support; been waiting for a callback for days.,Technical Problem
The user interface is clunky and difficult to navigate.,Technical Problem
Slow loading times are killing our productivity.,Technical Problem
Frequent crashes are causing data corruption issues.,Technical Problem
A glitch in the reporting module is producing inaccurate data.,Technical Problem
"API calls are timing out consistently, hindering automation.",Technical Problem
"The software randomly freezes, forcing me to restart my computer.",Technical Problem
The search function is completely broken; can't find anything.,Technical Problem
Unresponsive buttons are a constant source of frustration.,Technical Problem
Error code 500 – what does this even mean?  No help in the manual.,Technical Problem
Slow performance is impacting our team's ability to meet deadlines.,Technical Problem
The system crashed during a major data entry task.,Technical Problem
Integration failure with our email marketing platform is a disaster.,Technical Problem
The user interface is counterintuitive and frustrating.,Technical Problem
This bug is preventing us from accessing crucial client information.,Technical Problem
The software crashed during a client presentation.  Very unprofessional.,Technical Problem
Slow performance is hindering our ability to close deals.,Technical Problem
Error code 274 appears randomly and frequently.  No explanation provided.,Technical Problem
API integration with our existing system is a nightmare.,Technical Problem
Unresponsive support staff are not providing timely resolutions.,Technical Problem
The program is incredibly slow; even simple tasks take ages.,Technical Problem
The software crashed and I lost all my unsaved work.,Technical Problem
A glitch in the calendar function is double-booking appointments.,Technical Problem
Integration failure is causing inconsistencies in our data.,Technical Problem
The software is constantly freezing and lagging.  Needs a patch urgently.,Technical Problem
Unresponsive customer support is making this a terrible experience.,Technical Problem
The new update introduced a major bug that breaks the core functionality.,Technical Problem
Slow performance during peak load is unacceptable.,Technical Problem
"Error code 808 is appearing incessantly, preventing login.",Technical Problem
API calls are unreliable and frequently return errors.,Technical Problem
"This software is constantly crashing, making it unusable.",Technical Problem
Unresponsive elements make it difficult to complete tasks.,Technical Problem
The system crashed after a seemingly minor database update.,Technical Problem
The search function is slow and often returns inaccurate results.,Technical Problem
Integration with our existing infrastructure is proving challenging.,Technical Problem
The software's poor performance is affecting our bottom line.,Technical Problem
I'm constantly receiving error messages with no helpful information.,Technical Problem
The UI is incredibly difficult to learn and use effectively.,Technical Problem
The system is consistently unresponsive; it's frustrating.,Technical Problem
This bug prevents the accurate calculation of totals.,Technical Problem
Integration with our payment gateway keeps failing.,Technical Problem
Slow performance during the busiest time of day is a serious problem.,Technical Problem
"The software crashed unexpectedly, losing hours of work.",Technical Problem
A serious glitch is preventing access to critical data.,Technical Problem
API requests are failing with obscure error messages.,Technical Problem
Unresponsive support has left us stranded with a broken system.,Technical Problem
This software is too slow; it's hindering our efficiency.,Technical Problem
The software crashed again; this is the third time today.,Technical Problem
A bug in the reporting system is causing inaccurate financial reports.,Technical Problem
Integration failure is causing a major disruption to our workflow.,Technical Problem
The user interface is poorly designed and difficult to navigate.,Technical Problem
This bug has rendered a key feature completely unusable.,Technical Problem
Slow performance makes working with this software a chore.,Technical Problem
The software crashed and corrupted my data.,Technical Problem
"Integration with our database failed, preventing data updates.",Technical Problem
The user interface is unintuitive and lacks basic functionality.,Technical Problem
This bug is blocking access to a vital area of the program.,Technical Problem
Slow performance during peak usage is impacting our customer service.,Technical Problem
The software crashed while processing a large dataset.,Technical Problem
A glitch is causing unexpected errors in calculations.,Technical Problem
