query,category,query_clean,category_encoded
I'm having trouble with the email integration.,Product Question,im having trouble with the email integration.,3
How do I track my time effectively?,Product Question,how do i track my time effectively?,3
How do I find the latest version of the software?,Product Question,how do i find the latest version of the software?,3
I'm having trouble with the mobile version.,Product Question,im having trouble with the mobile version.,3
How do I manage my user profile settings?,Product Question,how do i manage my user profile settings?,3
What are the key features of the software?,Product Question,what are the key features of the software?,3
How do I backup my data?,Product Question,how do i backup my data?,3
I'm having trouble with the synchronization process.,Product Question,im having trouble with the synchronization process.,3
How do I troubleshoot common issues?,Product Question,how do i troubleshoot common issues?,3
I'm unsure how to use the inventory management feature.,Product Question,im unsure how to use the inventory management feature.,3
How do I generate reports based on specific criteria?,Product Question,how do i generate reports based on specific criteria?,3
The software is slow to load.,Product Question,the software is slow to load.,3
How do I get in touch with a sales representative?,Product Question,how do i get in touch with a sales representative?,3
Can I request additional features?,Product Question,can i request additional features?,3
I'm having trouble with the form builder.,Product Question,im having trouble with the form builder.,3
How do I migrate my data from another software?,Product Question,how do i migrate my data from another software?,3
I'm not sure how to use the CRM features.,Product Question,im not sure how to use the crm features.,3
How do I access the advanced options?,Product Question,how do i access the advanced options?,3
I'm having trouble understanding the pricing model.,Product Question,im having trouble understanding the pricing model.,3
The software crashes frequently.,Product Question,the software crashes frequently.,3
How do I create a new template?,Product Question,how do i create a new template?,3
How do I modify existing templates?,Product Question,how do i modify existing templates?,3
I'm having trouble understanding the reporting metrics.,Product Question,im having trouble understanding the reporting metrics.,3
How do I use the built-in calendar?,Product Question,how do i use the builtin calendar?,3
How do I add new clients?,Product Question,how do i add new clients?,3
How do I access customer support chat?,Product Question,how do i access customer support chat?,3
I need help understanding the software's architecture.,Product Question,i need help understanding the softwares architecture.,3
How do I generate a sales report?,Product Question,how do i generate a sales report?,3
How do I configure the notification settings?,Product Question,how do i configure the notification settings?,3
How do I utilize the collaboration tools?,Product Question,how do i utilize the collaboration tools?,3
I'm having issues with the data import feature.,Product Question,im having issues with the data import feature.,3
How do I manage user roles and permissions?,Product Question,how do i manage user roles and permissions?,3
I'm not receiving confirmation emails.,Product Question,im not receiving confirmation emails.,3
I'm having trouble accessing my previous work.,Product Question,im having trouble accessing my previous work.,3
How do I integrate this with other applications?,Product Question,how do i integrate this with other applications?,3
The software is very complex.,Product Question,the software is very complex.,3
How do I find tutorials or documentation?,Product Question,how do i find tutorials or documentation?,3
I need help with the billing system.,Product Question,i need help with the billing system.,3
I'm having issues with the user authentication.,Product Question,im having issues with the user authentication.,3
How do I add custom branding?,Product Question,how do i add custom branding?,3
I'm having trouble understanding the analytics.,Product Question,im having trouble understanding the analytics.,3
How do I manage my team's assignments?,Product Question,how do i manage my teams assignments?,3
I need help with the project management tools.,Product Question,i need help with the project management tools.,3
How do I export data in a specific format?,Product Question,how do i export data in a specific format?,3
The software isn't intuitive to use.,Product Question,the software isnt intuitive to use.,3
How do I set up automated reminders?,Product Question,how do i set up automated reminders?,3
How do I access the customer support portal?,Product Question,how do i access the customer support portal?,3
I'm having trouble with the workflow automation.,Product Question,im having trouble with the workflow automation.,3
I need help understanding the licensing terms.,Product Question,i need help understanding the licensing terms.,3
The software is too complicated.,Product Question,the software is too complicated.,3
How do I set up a new account?,Product Question,how do i set up a new account?,3
I'm having issues with the data synchronization.,Product Question,im having issues with the data synchronization.,3
I'm not familiar with the software's features.,Product Question,im not familiar with the softwares features.,3
How do I create a new report?,Product Question,how do i create a new report?,3
I'm having issues with the reporting features.,Product Question,im having issues with the reporting features.,3
I need help understanding the key performance indicators (KPIs).,Product Question,i need help understanding the key performance indicators kpis.,3
How do I customize the email notifications?,Product Question,how do i customize the email notifications?,3
The software's performance is slow.,Product Question,the softwares performance is slow.,3
How do I manage user access?,Product Question,how do i manage user access?,3
I need help understanding the security features.,Product Question,i need help understanding the security features.,3
I'm having trouble with the user management system.,Product Question,im having trouble with the user management system.,3
How do I track project deadlines?,Product Question,how do i track project deadlines?,3
How do I access the audit logs?,Product Question,how do i access the audit logs?,3
I'm having issues with the data validation rules.,Product Question,im having issues with the data validation rules.,3
How do I customize the notification preferences?,Product Question,how do i customize the notification preferences?,3
The software requires too much training.,Product Question,the software requires too much training.,3
How do I troubleshoot error messages?,Product Question,how do i troubleshoot error messages?,3
I need help with the formula editor.,Product Question,i need help with the formula editor.,3
How do I manage my user groups?,Product Question,how do i manage my user groups?,3
I'm having issues with the API integration.,Product Question,im having issues with the api integration.,3
How do I access customer support resources?,Product Question,how do i access customer support resources?,3
The software is not user friendly.,Product Question,the software is not user friendly.,3
How do I setup recurring tasks?,Product Question,how do i setup recurring tasks?,3
How do I use the time tracking feature?,Product Question,how do i use the time tracking feature?,3
I'm having issues with the reporting dashboard.,Product Question,im having issues with the reporting dashboard.,3
How do I customize the report layout?,Product Question,how do i customize the report layout?,3
I'm not sure how to use the workflow editor.,Product Question,im not sure how to use the workflow editor.,3
I need help with the data analysis tools.,Product Question,i need help with the data analysis tools.,3
The software doesn't work as expected.,Product Question,the software doesnt work as expected.,3
How do I manage my company settings?,Product Question,how do i manage my company settings?,3
How do I configure the security settings?,Product Question,how do i configure the security settings?,3
I'm having trouble understanding the user interface.,Product Question,im having trouble understanding the user interface.,3
I'm having issues with the data backup and restore process.,Product Question,im having issues with the data backup and restore process.,3
How do I use the advanced search capabilities?,Product Question,how do i use the advanced search capabilities?,3
The software is hard to use.,Product Question,the software is hard to use.,3
How do I set up single sign-on (SSO)?,Product Question,how do i set up single signon sso?,3
How do I manage my user permissions?,Product Question,how do i manage my user permissions?,3
I'm having trouble with the data cleansing process.,Product Question,im having trouble with the data cleansing process.,3
How do I set up automatic backups?,Product Question,how do i set up automatic backups?,3
I need help with the project reporting features.,Product Question,i need help with the project reporting features.,3
The software is not efficient.,Product Question,the software is not efficient.,3
How do I create a new customer profile?,Product Question,how do i create a new customer profile?,3
How do I use the reporting filters?,Product Question,how do i use the reporting filters?,3
I'm having issues with the invoice generation process.,Product Question,im having issues with the invoice generation process.,3
How do I access the system logs?,Product Question,how do i access the system logs?,3
I need help understanding the data model.,Product Question,i need help understanding the data model.,3
The software's user experience is poor.,Product Question,the softwares user experience is poor.,3
How do I set up custom reports?,Product Question,how do i set up custom reports?,3
How do I use the data visualization features?,Product Question,how do i use the data visualization features?,3
I'm having issues with the payment processing system.,Product Question,im having issues with the payment processing system.,3
How do I manage my team's workload?,Product Question,how do i manage my teams workload?,3
I need help understanding the project tracking features.,Product Question,i need help understanding the project tracking features.,3
The software is very complicated.,Product Question,the software is very complicated.,3
How do I configure the system settings?,Product Question,how do i configure the system settings?,3
How do I create a new workflow?,Product Question,how do i create a new workflow?,3
I'm having issues with the data migration tool.,Product Question,im having issues with the data migration tool.,3
How do I use the automated reporting features?,Product Question,how do i use the automated reporting features?,3
I need help understanding the financial reports.,Product Question,i need help understanding the financial reports.,3
The software is very confusing.,Product Question,the software is very confusing.,3
How do I manage my user accounts?,Product Question,how do i manage my user accounts?,3
How do I configure the system notifications?,Product Question,how do i configure the system notifications?,3
I'm having issues with the user interface design.,Product Question,im having issues with the user interface design.,3
How do I access the system configuration settings?,Product Question,how do i access the system configuration settings?,3
I need help with the software's performance optimization.,Product Question,i need help with the softwares performance optimization.,3
The software is not very intuitive.,Product Question,the software is not very intuitive.,3
How do I configure the network settings?,Product Question,how do i configure the network settings?,3
How do I use the software's advanced features?,Product Question,how do i use the softwares advanced features?,3
I'm having issues with the data integration process.,Product Question,im having issues with the data integration process.,3
How do I access the customer support documentation?,Product Question,how do i access the customer support documentation?,3
I need help with the software's security protocols.,Product Question,i need help with the softwares security protocols.,3
The software is not very efficient.,Product Question,the software is not very efficient.,3
How do I configure the system logs?,Product Question,how do i configure the system logs?,3
How do I use the software's administrative tools?,Product Question,how do i use the softwares administrative tools?,3
I'm having issues with the data validation process.,Product Question,im having issues with the data validation process.,3
How do I access the software's advanced options?,Product Question,how do i access the softwares advanced options?,3
I need help with the software's customization features.,Product Question,i need help with the softwares customization features.,3
What kind of reporting capabilities does it have?,Product Question,what kind of reporting capabilities does it have?,3
How easy is it to customize the dashboard?,Product Question,how easy is it to customize the dashboard?,3
I'm a bit tech-challenged; is it user-friendly?,Product Question,im a bit techchallenged is it userfriendly?,3
What level of technical support do you offer?,Product Question,what level of technical support do you offer?,3
Does the software work offline?,Product Question,does the software work offline?,3
How much does it cost to add more users?,Product Question,how much does it cost to add more users?,3
What are the different pricing tiers?,Product Question,what are the different pricing tiers?,3
Does it integrate with Slack or Microsoft Teams?,Product Question,does it integrate with slack or microsoft teams?,3
Is it possible to export data to Excel or CSV?,Product Question,is it possible to export data to excel or csv?,3
Does the software support different languages?,Product Question,does the software support different languages?,3
How frequently are software updates released?,Product Question,how frequently are software updates released?,3
What is the process for requesting new features?,Product Question,what is the process for requesting new features?,3
Are there any limitations on data storage?,Product Question,are there any limitations on data storage?,3
Will you help us migrate data from our old system?,Product Question,will you help us migrate data from our old system?,3
What is the average response time for customer support?,Product Question,what is the average response time for customer support?,3
Does the software scale well with a growing business?,Product Question,does the software scale well with a growing business?,3
What kind of training materials are available?,Product Question,what kind of training materials are available?,3
Is there a dedicated account manager?,Product Question,is there a dedicated account manager?,3
What is the renewal process like?,Product Question,what is the renewal process like?,3
Is there a limit to the number of custom reports I can create?,Product Question,is there a limit to the number of custom reports i can create?,3
Does the software offer automation features?,Product Question,does the software offer automation features?,3
Can I access my data from anywhere in the world?,Product Question,can i access my data from anywhere in the world?,3
Does the software comply with GDPR regulations?,Product Question,does the software comply with gdpr regulations?,3
Is there a way to track user activity?,Product Question,is there a way to track user activity?,3
How long does it take to implement the software?,Product Question,how long does it take to implement the software?,3
What kind of data backup and recovery options are available?,Product Question,what kind of data backup and recovery options are available?,3
Can I customize the email notifications?,Product Question,can i customize the email notifications?,3
Is there an API available for integration with other apps?,Product Question,is there an api available for integration with other apps?,3
Does the software support different currencies?,Product Question,does the software support different currencies?,3
Can we use our own custom domain name?,Product Question,can we use our own custom domain name?,3
How does the software handle data privacy?,Product Question,how does the software handle data privacy?,3
Does it offer any project management features?,Product Question,does it offer any project management features?,3
Is there a way to test out different features before purchasing?,Product Question,is there a way to test out different features before purchasing?,3
Are there any hidden fees or charges?,Product Question,are there any hidden fees or charges?,3
How reliable is the software in terms of uptime?,Product Question,how reliable is the software in terms of uptime?,3
What is the cancellation policy?,Product Question,what is the cancellation policy?,3
Does the software use cloud storage?,Product Question,does the software use cloud storage?,3
How can I manage my subscriptions?,Product Question,how can i manage my subscriptions?,3
What happens if I forget my password?,Product Question,what happens if i forget my password?,3
Does the software offer real-time data updates?,Product Question,does the software offer realtime data updates?,3
Is there a community forum for users?,Product Question,is there a community forum for users?,3
Does the software have audit trail functionality?,Product Question,does the software have audit trail functionality?,3
Can I set up different permission levels for my team?,Product Question,can i set up different permission levels for my team?,3
Are there any limitations on file size uploads?,Product Question,are there any limitations on file size uploads?,3
What types of payment methods are accepted?,Product Question,what types of payment methods are accepted?,3
How often are security patches released?,Product Question,how often are security patches released?,3
Does the software integrate with Google Workspace?,Product Question,does the software integrate with google workspace?,3
What are the limitations of the free plan?,Product Question,what are the limitations of the free plan?,3
Is the software HIPAA compliant?,Product Question,is the software hipaa compliant?,3
How do I get started after purchasing the software?,Product Question,how do i get started after purchasing the software?,3
What is your company's reputation in the industry?,Product Question,what is your companys reputation in the industry?,3
Is the software compatible with Mac OS?,Product Question,is the software compatible with mac os?,3
Can I access historical data reports?,Product Question,can i access historical data reports?,3
Does it integrate with Salesforce?,Product Question,does it integrate with salesforce?,3
Is there a limit to the number of contacts I can store?,Product Question,is there a limit to the number of contacts i can store?,3
How many users can I have on a single license?,Product Question,how many users can i have on a single license?,3
Does it support two-factor authentication?,Product Question,does it support twofactor authentication?,3
Can I create custom workflows?,Product Question,can i create custom workflows?,3
Are there any templates available for common tasks?,Product Question,are there any templates available for common tasks?,3
Does it offer customer relationship management (CRM) tools?,Product Question,does it offer customer relationship management crm tools?,3
What are the benefits of using this software over competitors?,Product Question,what are the benefits of using this software over competitors?,3
How do I get support if I have a problem after hours?,Product Question,how do i get support if i have a problem after hours?,3
Does the software provide a good user experience?,Product Question,does the software provide a good user experience?,3
Can I personalize the software interface?,Product Question,can i personalize the software interface?,3
Does it offer help documentation in multiple languages?,Product Question,does it offer help documentation in multiple languages?,3
Is there an option to set up automated reminders?,Product Question,is there an option to set up automated reminders?,3
How does the software handle large datasets?,Product Question,how does the software handle large datasets?,3
Is it possible to segment my data for reporting?,Product Question,is it possible to segment my data for reporting?,3
Can I integrate this with our accounting software?,Product Question,can i integrate this with our accounting software?,3
What are the potential benefits of using this software?,Product Question,what are the potential benefits of using this software?,3
Can we create custom fields for data entry?,Product Question,can we create custom fields for data entry?,3
Is it easy to generate reports on key performance indicators (KPIs)?,Product Question,is it easy to generate reports on key performance indicators kpis?,3
Does the software offer a mobile-friendly interface?,Product Question,does the software offer a mobilefriendly interface?,3
Does it provide real-time analytics and dashboards?,Product Question,does it provide realtime analytics and dashboards?,3
Is there any integration with social media platforms?,Product Question,is there any integration with social media platforms?,3
What kind of support is offered during the implementation phase?,Product Question,what kind of support is offered during the implementation phase?,3
Does the software provide any data visualization tools?,Product Question,does the software provide any data visualization tools?,3
How long does onboarding take?,Product Question,how long does onboarding take?,3
Does it offer a satisfaction guarantee?,Product Question,does it offer a satisfaction guarantee?,3
Is there a dedicated support team available?,Product Question,is there a dedicated support team available?,3
Can I access my data from multiple devices?,Product Question,can i access my data from multiple devices?,3
Are there any tutorials available to help me learn the software?,Product Question,are there any tutorials available to help me learn the software?,3
Does the software offer customizable notification settings?,Product Question,does the software offer customizable notification settings?,3
How easy is it to collaborate with my team members?,Product Question,how easy is it to collaborate with my team members?,3
Does it allow for real-time chat communication?,Product Question,does it allow for realtime chat communication?,3
Can the software be integrated with our existing payroll system?,Product Question,can the software be integrated with our existing payroll system?,3
Does the software support different file formats?,Product Question,does the software support different file formats?,3
What is the expected downtime for the software?,Product Question,what is the expected downtime for the software?,3
How can I track the progress of my team's projects?,Product Question,how can i track the progress of my teams projects?,3
Does it offer any time-tracking capabilities?,Product Question,does it offer any timetracking capabilities?,3
Is there a way to schedule automatic backups?,Product Question,is there a way to schedule automatic backups?,3
Is the software regularly updated with new features?,Product Question,is the software regularly updated with new features?,3
How secure is the software from cyber threats?,Product Question,how secure is the software from cyber threats?,3
Does the software integrate with my marketing automation tools?,Product Question,does the software integrate with my marketing automation tools?,3
What is the process for submitting feedback or bug reports?,Product Question,what is the process for submitting feedback or bug reports?,3
Are there any known limitations or bugs with the software?,Product Question,are there any known limitations or bugs with the software?,3
How do I manage user roles and permissions within the system?,Product Question,how do i manage user roles and permissions within the system?,3
Does the software comply with industry best practices for security?,Product Question,does the software comply with industry best practices for security?,3
What kind of performance can I expect from the software?,Product Question,what kind of performance can i expect from the software?,3
Is there a way to filter and sort data efficiently?,Product Question,is there a way to filter and sort data efficiently?,3
Can I easily search for specific information within the software?,Product Question,can i easily search for specific information within the software?,3
How can I export and import my data from external sources?,Product Question,how can i export and import my data from external sources?,3
Does the software offer customizable templates for different document types?,Product Question,does the software offer customizable templates for different document types?,3
What is the total cost of ownership for this software solution?,Product Question,what is the total cost of ownership for this software solution?,3
Is there an option for tiered pricing based on usage?,Product Question,is there an option for tiered pricing based on usage?,3
Can I customize the software's branding to match our company identity?,Product Question,can i customize the softwares branding to match our company identity?,3
Does it integrate with our existing communication platforms?,Product Question,does it integrate with our existing communication platforms?,3
Does the software have a user-friendly interface for both desktop and mobile?,Product Question,does the software have a userfriendly interface for both desktop and mobile?,3
