query,category,query_clean,category_encoded
It took me hours to figure out why my client's invoice wasn't generating.  The error message was unhelpful.,Billing Issue,it took me hours to figure out why my clients invoice wasnt generating. the error message was unhelpful.,0
I accidentally double-billed a customer.  This software needs better safeguards against that.,Billing Issue,i accidentally doublebilled a customer. this software needs better safeguards against that.,0
The payment processing integrated with this software is ridiculously slow.,Billing Issue,the payment processing integrated with this software is ridiculously slow.,0
I can't seem to reconcile my bank statement with the software's reports.,Billing Issue,i cant seem to reconcile my bank statement with the softwares reports.,0
There's a bug that's causing some invoices to show a zero balance.,Billing Issue,theres a bug thats causing some invoices to show a zero balance.,0
The software keeps freezing when I try to generate large batches of invoices.,Billing Issue,the software keeps freezing when i try to generate large batches of invoices.,0
I'm having trouble exporting my billing data into a usable format.,Billing Issue,im having trouble exporting my billing data into a usable format.,0
The customer portal is confusing and my clients are complaining.,Billing Issue,the customer portal is confusing and my clients are complaining.,0
I've been charged a hidden fee I wasn't aware of.  This is unacceptable.,Billing Issue,ive been charged a hidden fee i wasnt aware of. this is unacceptable.,0
The recurring billing feature is unreliable; some clients aren't being billed.,Billing Issue,the recurring billing feature is unreliable some clients arent being billed.,0
It's too difficult to apply credits or discounts to invoices.,Billing Issue,its too difficult to apply credits or discounts to invoices.,0
I spent ages trying to track down a missing payment.  The search function is terrible.,Billing Issue,i spent ages trying to track down a missing payment. the search function is terrible.,0
This software is constantly glitching when it comes to processing refunds.,Billing Issue,this software is constantly glitching when it comes to processing refunds.,0
The invoice templates are too basic and don't meet my business needs.,Billing Issue,the invoice templates are too basic and dont meet my business needs.,0
I wish there was a better way to customize the invoice numbers.,Billing Issue,i wish there was a better way to customize the invoice numbers.,0
It's frustrating that I can't edit already-sent invoices.,Billing Issue,its frustrating that i cant edit alreadysent invoices.,0
My clients are receiving duplicate invoices.  This is a major problem.,Billing Issue,my clients are receiving duplicate invoices. this is a major problem.,0
The reporting features are clunky and difficult to navigate.,Billing Issue,the reporting features are clunky and difficult to navigate.,0
I'm getting payment errors that I can't troubleshoot.,Billing Issue,im getting payment errors that i cant troubleshoot.,0
The software isn't compatible with my preferred payment gateway.,Billing Issue,the software isnt compatible with my preferred payment gateway.,0
I can't generate accurate financial reports because of data inconsistencies.,Billing Issue,i cant generate accurate financial reports because of data inconsistencies.,0
It's hard to track late payments and follow up with customers.,Billing Issue,its hard to track late payments and follow up with customers.,0
The tax calculations are often incorrect.  This is a serious liability.,Billing Issue,the tax calculations are often incorrect. this is a serious liability.,0
I had to manually fix several billing errors.  This is a waste of my time.,Billing Issue,i had to manually fix several billing errors. this is a waste of my time.,0
The customer support was unhelpful and couldn't resolve my issue.,Billing Issue,the customer support was unhelpful and couldnt resolve my issue.,0
It's difficult to manage multiple currencies with this software.,Billing Issue,its difficult to manage multiple currencies with this software.,0
The system crashed and I lost several hours of work.  I'm furious.,Billing Issue,the system crashed and i lost several hours of work. im furious.,0
I'm constantly getting incorrect totals on my invoices.,Billing Issue,im constantly getting incorrect totals on my invoices.,0
It's almost impossible to understand the pricing structure.,Billing Issue,its almost impossible to understand the pricing structure.,0
The software overcharges on certain transactions.,Billing Issue,the software overcharges on certain transactions.,0
There's a major discrepancy between what I've billed and what I've received.,Billing Issue,theres a major discrepancy between what ive billed and what ive received.,0
I can't access my billing history after a certain date.,Billing Issue,i cant access my billing history after a certain date.,0
The software's user interface is confusing and unintuitive when it comes to billing.,Billing Issue,the softwares user interface is confusing and unintuitive when it comes to billing.,0
It took forever to get a refund for an overcharged client.,Billing Issue,it took forever to get a refund for an overcharged client.,0
This program is not designed for international billing.,Billing Issue,this program is not designed for international billing.,0
I've lost confidence in the accuracy of this billing system.,Billing Issue,ive lost confidence in the accuracy of this billing system.,0
It keeps assigning the wrong payment methods to invoices.,Billing Issue,it keeps assigning the wrong payment methods to invoices.,0
There's no way to easily void an invoice.,Billing Issue,theres no way to easily void an invoice.,0
The software is too complex for simple billing needs.,Billing Issue,the software is too complex for simple billing needs.,0
I wish there was a better audit trail for transactions.,Billing Issue,i wish there was a better audit trail for transactions.,0
The help documentation is inadequate and doesn't address my problem.,Billing Issue,the help documentation is inadequate and doesnt address my problem.,0
I'm worried about potential auditing issues with this software.,Billing Issue,im worried about potential auditing issues with this software.,0
The system randomly changes invoice dates.,Billing Issue,the system randomly changes invoice dates.,0
This software made it too difficult to process client payments.,Billing Issue,this software made it too difficult to process client payments.,0
It's hard to track down specific transactions within the software.,Billing Issue,its hard to track down specific transactions within the software.,0
The software's performance is extremely slow when handling large invoices.,Billing Issue,the softwares performance is extremely slow when handling large invoices.,0
I'm concerned about the security of my client's payment information.,Billing Issue,im concerned about the security of my clients payment information.,0
The billing system frequently crashes during peak hours.,Billing Issue,the billing system frequently crashes during peak hours.,0
It's impossible to schedule invoices in advance reliably.,Billing Issue,its impossible to schedule invoices in advance reliably.,0
It keeps generating invoices with the incorrect company information.,Billing Issue,it keeps generating invoices with the incorrect company information.,0
I'm losing business because of the unreliable billing process.,Billing Issue,im losing business because of the unreliable billing process.,0
"The software failed to record a payment, leaving a false balance.",Billing Issue,"the software failed to record a payment, leaving a false balance.",0
It's very difficult to use this software on mobile devices.,Billing Issue,its very difficult to use this software on mobile devices.,0
I've had countless issues with the auto-payment feature.,Billing Issue,ive had countless issues with the autopayment feature.,0
The software doesn't allow for sufficient customization of invoices.,Billing Issue,the software doesnt allow for sufficient customization of invoices.,0
Getting a prompt response from customer support is impossible.,Billing Issue,getting a prompt response from customer support is impossible.,0
I received a strange error message I couldn't decode.,Billing Issue,i received a strange error message i couldnt decode.,0
I'm constantly having to manually correct billing errors.,Billing Issue,im constantly having to manually correct billing errors.,0
The system is unreliable for generating accurate sales reports.,Billing Issue,the system is unreliable for generating accurate sales reports.,0
It’s cumbersome to generate reports that I can easily share with my accountant.,Billing Issue,its cumbersome to generate reports that i can easily share with my accountant.,0
The software lacked any clear instruction on its billing processes.,Billing Issue,the software lacked any clear instruction on its billing processes.,0
I’m frustrated that the software doesn't integrate with my accounting program.,Billing Issue,im frustrated that the software doesnt integrate with my accounting program.,0
It failed to update its currency exchange rates.,Billing Issue,it failed to update its currency exchange rates.,0
I had to spend hours correcting the software's billing mistakes.,Billing Issue,i had to spend hours correcting the softwares billing mistakes.,0
The software didn't send out any billing reminders.,Billing Issue,the software didnt send out any billing reminders.,0
It’s nearly impossible to understand how the fees are calculated.,Billing Issue,its nearly impossible to understand how the fees are calculated.,0
Many invoices have missing or incorrect information.,Billing Issue,many invoices have missing or incorrect information.,0
My clients are complaining about unclear invoice descriptions.,Billing Issue,my clients are complaining about unclear invoice descriptions.,0
The payment gateway keeps rejecting transactions.,Billing Issue,the payment gateway keeps rejecting transactions.,0
"The system is frequently down for maintenance, disrupting my workflow.",Billing Issue,"the system is frequently down for maintenance, disrupting my workflow.",0
The recurring billing setup is too complicated.,Billing Issue,the recurring billing setup is too complicated.,0
It's very difficult to delete an invoice accidentally created.,Billing Issue,its very difficult to delete an invoice accidentally created.,0
It’s not user-friendly for someone who isn't tech-savvy.,Billing Issue,its not userfriendly for someone who isnt techsavvy.,0
The software keeps applying incorrect taxes to invoices.,Billing Issue,the software keeps applying incorrect taxes to invoices.,0
The reporting functionality is extremely limited.,Billing Issue,the reporting functionality is extremely limited.,0
I spent a whole day trying to fix a simple billing issue.,Billing Issue,i spent a whole day trying to fix a simple billing issue.,0
The customer support was unresponsive to my queries.,Billing Issue,the customer support was unresponsive to my queries.,0
The interface is cluttered and difficult to navigate for billing.,Billing Issue,the interface is cluttered and difficult to navigate for billing.,0
It's hard to find specific invoices in the system.,Billing Issue,its hard to find specific invoices in the system.,0
The software frequently lags when processing payments.,Billing Issue,the software frequently lags when processing payments.,0
I’ve experienced numerous unexpected billing errors.,Billing Issue,ive experienced numerous unexpected billing errors.,0
This software has significantly impacted my business efficiency.,Billing Issue,this software has significantly impacted my business efficiency.,0
The software's features are not intuitive for billing tasks.,Billing Issue,the softwares features are not intuitive for billing tasks.,0
It is difficult to trace the history of a payment transaction.,Billing Issue,it is difficult to trace the history of a payment transaction.,0
The software failed to properly allocate payments to invoices.,Billing Issue,the software failed to properly allocate payments to invoices.,0
It does not offer enough flexibility in managing payment plans.,Billing Issue,it does not offer enough flexibility in managing payment plans.,0
The software’s features are poorly integrated for billing.,Billing Issue,the softwares features are poorly integrated for billing.,0
It's challenging to track outstanding invoices.,Billing Issue,its challenging to track outstanding invoices.,0
The invoice generation process is unnecessarily complicated.,Billing Issue,the invoice generation process is unnecessarily complicated.,0
It consistently fails to send out invoices on time.,Billing Issue,it consistently fails to send out invoices on time.,0
There is no clear explanation for the discrepancies in billing.,Billing Issue,there is no clear explanation for the discrepancies in billing.,0
I have lost significant amounts of time due to software glitches.,Billing Issue,i have lost significant amounts of time due to software glitches.,0
The software lacks proper validation checks for billing data.,Billing Issue,the software lacks proper validation checks for billing data.,0
The software failed to reflect changes in tax rates.,Billing Issue,the software failed to reflect changes in tax rates.,0
It's difficult to understand the reason for declined payments.,Billing Issue,its difficult to understand the reason for declined payments.,0
It’s frustrating to have to constantly double-check invoice details.,Billing Issue,its frustrating to have to constantly doublecheck invoice details.,0
The system’s error messages are unhelpful and confusing.,Billing Issue,the systems error messages are unhelpful and confusing.,0
The software doesn't offer adequate support for different payment terms.,Billing Issue,the software doesnt offer adequate support for different payment terms.,0
It doesn't provide useful summaries of my financial status.,Billing Issue,it doesnt provide useful summaries of my financial status.,0
The reconciliation process is very time-consuming.,Billing Issue,the reconciliation process is very timeconsuming.,0
"The software has frequent downtime, causing billing delays.",Billing Issue,"the software has frequent downtime, causing billing delays.",0
It's complicated to manage different billing cycles.,Billing Issue,its complicated to manage different billing cycles.,0
It's very hard to search for specific customers' invoices.,Billing Issue,its very hard to search for specific customers invoices.,0
I had issues with the software automatically applying discounts.,Billing Issue,i had issues with the software automatically applying discounts.,0
The system doesn't handle partial payments effectively.,Billing Issue,the system doesnt handle partial payments effectively.,0
I couldn't access my billing settings for a prolonged period.,Billing Issue,i couldnt access my billing settings for a prolonged period.,0
The software provides poor data visualization for billing.,Billing Issue,the software provides poor data visualization for billing.,0
It's nearly impossible to identify and correct billing errors.,Billing Issue,its nearly impossible to identify and correct billing errors.,0
The software unexpectedly applied the wrong payment terms.,Billing Issue,the software unexpectedly applied the wrong payment terms.,0
The billing reports are inaccurate and unreliable.,Billing Issue,the billing reports are inaccurate and unreliable.,0
I experienced an issue with invoice numbering sequences.,Billing Issue,i experienced an issue with invoice numbering sequences.,0
The software is slow and clunky when it comes to invoicing.,Billing Issue,the software is slow and clunky when it comes to invoicing.,0
It is very difficult to adjust billing settings.,Billing Issue,it is very difficult to adjust billing settings.,0
The software is prone to data loss.,Billing Issue,the software is prone to data loss.,0
The system has not been updated to reflect current tax laws.,Billing Issue,the system has not been updated to reflect current tax laws.,0
It's difficult to monitor the financial health of my business.,Billing Issue,its difficult to monitor the financial health of my business.,0
The software is simply too expensive for the issues it causes.,Billing Issue,the software is simply too expensive for the issues it causes.,0
The software failed to properly apply credits to an invoice.,Billing Issue,the software failed to properly apply credits to an invoice.,0
It didn't record a payment made by a client.,Billing Issue,it didnt record a payment made by a client.,0
It overcharges me for certain features.,Billing Issue,it overcharges me for certain features.,0
The software crashed multiple times while I was generating invoices.,Billing Issue,the software crashed multiple times while i was generating invoices.,0
It failed to send email notifications about late payments.,Billing Issue,it failed to send email notifications about late payments.,0
The software's billing system is too outdated.,Billing Issue,the softwares billing system is too outdated.,0
I found it very difficult to manage my subscriptions.,Billing Issue,i found it very difficult to manage my subscriptions.,0
The software keeps sending out incorrect invoices.,Billing Issue,the software keeps sending out incorrect invoices.,0
It is not suitable for managing complex billing structures.,Billing Issue,it is not suitable for managing complex billing structures.,0
I had trouble understanding the software’s billing reports.,Billing Issue,i had trouble understanding the softwares billing reports.,0
The software’s user interface is unfriendly to new users.,Billing Issue,the softwares user interface is unfriendly to new users.,0
It's challenging to generate invoices in different formats.,Billing Issue,its challenging to generate invoices in different formats.,0
It has caused me significant financial losses.,Billing Issue,it has caused me significant financial losses.,0
It's very difficult to track outstanding payments.,Billing Issue,its very difficult to track outstanding payments.,0
I couldn't get in touch with customer support when I needed help.,Billing Issue,i couldnt get in touch with customer support when i needed help.,0
The software keeps freezing when I try to process refunds.,Billing Issue,the software keeps freezing when i try to process refunds.,0
The software is not efficient for handling large volumes of invoices.,Billing Issue,the software is not efficient for handling large volumes of invoices.,0
It lacks a user-friendly interface for managing billing information.,Billing Issue,it lacks a userfriendly interface for managing billing information.,0
The software makes it hard to keep track of my expenses.,Billing Issue,the software makes it hard to keep track of my expenses.,0
I'm constantly running into bugs that affect billing.,Billing Issue,im constantly running into bugs that affect billing.,0
The payment processing is too unreliable.,Billing Issue,the payment processing is too unreliable.,0
The software’s support is unavailable during key business hours.,Billing Issue,the softwares support is unavailable during key business hours.,0
It's almost impossible to troubleshoot billing issues.,Billing Issue,its almost impossible to troubleshoot billing issues.,0
The software doesn't integrate well with my other business tools.,Billing Issue,the software doesnt integrate well with my other business tools.,0
It's difficult to manage multiple clients' billing information.,Billing Issue,its difficult to manage multiple clients billing information.,0
The software is very unstable and prone to crashing.,Billing Issue,the software is very unstable and prone to crashing.,0
I'm concerned about the security of my billing data.,Billing Issue,im concerned about the security of my billing data.,0
The software's billing features are very limited.,Billing Issue,the softwares billing features are very limited.,0
The software is not intuitive to use for invoicing.,Billing Issue,the software is not intuitive to use for invoicing.,0
It's hard to track my revenue using this software.,Billing Issue,its hard to track my revenue using this software.,0
The software lacks essential billing features.,Billing Issue,the software lacks essential billing features.,0
The software doesn’t allow for enough flexibility in billing.,Billing Issue,the software doesnt allow for enough flexibility in billing.,0
It makes simple tasks unnecessarily complicated.,Billing Issue,it makes simple tasks unnecessarily complicated.,0
I'm disappointed with the overall performance of this software.,Billing Issue,im disappointed with the overall performance of this software.,0
It keeps adding incorrect charges to my invoices.,Billing Issue,it keeps adding incorrect charges to my invoices.,0
I'm seriously considering switching to a different software.,Billing Issue,im seriously considering switching to a different software.,0
The software makes it difficult to manage my expenses and revenue.,Billing Issue,the software makes it difficult to manage my expenses and revenue.,0
It is not at all user-friendly for the billing features.,Billing Issue,it is not at all userfriendly for the billing features.,0
It is very difficult to generate customized invoices.,Billing Issue,it is very difficult to generate customized invoices.,0
I'm worried about the accuracy of the billing data.,Billing Issue,im worried about the accuracy of the billing data.,0
The recurring billing feature is often unreliable.,Billing Issue,the recurring billing feature is often unreliable.,0
It’s not suitable for businesses with complex billing needs.,Billing Issue,its not suitable for businesses with complex billing needs.,0
The software is slow and unresponsive when dealing with billing data.,Billing Issue,the software is slow and unresponsive when dealing with billing data.,0
It makes reconciliation very difficult.,Billing Issue,it makes reconciliation very difficult.,0
The software's billing system is far too complicated.,Billing Issue,the softwares billing system is far too complicated.,0
This software is not worth the price.,Billing Issue,this software is not worth the price.,0
It's difficult to get a clear overview of my financial situation.,Billing Issue,its difficult to get a clear overview of my financial situation.,0
The software has major bugs in the payment processing feature.,Billing Issue,the software has major bugs in the payment processing feature.,0
The invoice templates are very limited and not customizable.,Billing Issue,the invoice templates are very limited and not customizable.,0
The software doesn't provide adequate support for international clients.,Billing Issue,the software doesnt provide adequate support for international clients.,0
It is almost impossible to use this software effectively.,Billing Issue,it is almost impossible to use this software effectively.,0
I'm having trouble integrating the software with my existing systems.,Billing Issue,im having trouble integrating the software with my existing systems.,0
The software's reporting is not very helpful.,Billing Issue,the softwares reporting is not very helpful.,0
It keeps crashing during peak times.,Billing Issue,it keeps crashing during peak times.,0
The customer service is dreadful.,Billing Issue,the customer service is dreadful.,0
The software is too expensive for what it offers.,Billing Issue,the software is too expensive for what it offers.,0
The software is very unreliable.,Billing Issue,the software is very unreliable.,0
It causes a lot of frustration.,Billing Issue,it causes a lot of frustration.,0
I regret buying this software.,Billing Issue,i regret buying this software.,0
The software is badly designed.,Billing Issue,the software is badly designed.,0
It's a waste of money.,Billing Issue,its a waste of money.,0
I would not recommend this software.,Billing Issue,i would not recommend this software.,0
I'm switching to a different provider.,Billing Issue,im switching to a different provider.,0
"The billing was completely wrong this month, way overcharged.  Need to get this sorted ASAP.",Billing Issue,"the billing was completely wrong this month, way overcharged. need to get this sorted asap.",0
My invoice is missing several line items.  Can you please provide a corrected one?,Billing Issue,my invoice is missing several line items. can you please provide a corrected one?,0
I'm being charged for a service I canceled last month. This is unacceptable.,Billing Issue,im being charged for a service i canceled last month. this is unacceptable.,0
The system keeps auto-renewing even though I unchecked that option.  Frustrating!,Billing Issue,the system keeps autorenewing even though i unchecked that option. frustrating!,0
There's a discrepancy between what I was quoted and what I'm being billed.,Billing Issue,theres a discrepancy between what i was quoted and what im being billed.,0
"I received a late payment notice, but I paid on time.  Please investigate.",Billing Issue,"i received a late payment notice, but i paid on time. please investigate.",0
My credit card was charged twice. I need a refund for the duplicate charge.,Billing Issue,my credit card was charged twice. i need a refund for the duplicate charge.,0
The billing details on the invoice are incorrect.  My address is wrong.,Billing Issue,the billing details on the invoice are incorrect. my address is wrong.,0
I can't find a way to download my invoice. The system is clunky.,Billing Issue,i cant find a way to download my invoice. the system is clunky.,0
I need a detailed breakdown of my charges. The summary isn't enough.,Billing Issue,i need a detailed breakdown of my charges. the summary isnt enough.,0
