query,category,query_clean,category_encoded
It's made our work lives much simpler and more enjoyable.  Thank you!,Compliment,its made our work lives much simpler and more enjoyable. thank you!,2
The software has significantly improved our overall customer satisfaction.,Compliment,the software has significantly improved our overall customer satisfaction.,2
I appreciate the regular updates and commitment to improvement.,Compliment,i appreciate the regular updates and commitment to improvement.,2
This is the best business solution we’ve ever invested in.,Compliment,this is the best business solution weve ever invested in.,2
It has simplified our workflow and reduced our administrative burden.,Compliment,it has simplified our workflow and reduced our administrative burden.,2
The software is intuitive and requires minimal training.  Perfect for our team.,Compliment,the software is intuitive and requires minimal training. perfect for our team.,2
This is a truly exceptional product that we highly recommend.,Compliment,this is a truly exceptional product that we highly recommend.,2
The software has helped us to achieve significant cost savings.,Compliment,the software has helped us to achieve significant cost savings.,2
It is an essential tool for our business and we couldn't be happier.,Compliment,it is an essential tool for our business and we couldnt be happier.,2
It's a fantastic investment for any business looking to boost productivity.,Compliment,its a fantastic investment for any business looking to boost productivity.,2
"The intuitive design makes it a breeze to use, even for beginners.",Compliment,"the intuitive design makes it a breeze to use, even for beginners.",2
This software has made a significant positive impact on our company.,Compliment,this software has made a significant positive impact on our company.,2
I'm absolutely delighted with this software and highly recommend it.,Compliment,im absolutely delighted with this software and highly recommend it.,2
"The software's performance is excellent, even under heavy load.",Compliment,"the softwares performance is excellent, even under heavy load.",2
The customer support has been exceptional throughout the entire process.,Compliment,the customer support has been exceptional throughout the entire process.,2
This is a must-have for any business serious about efficiency.,Compliment,this is a musthave for any business serious about efficiency.,2
It has greatly improved our team's ability to collaborate effectively.,Compliment,it has greatly improved our teams ability to collaborate effectively.,2
I'm so glad we chose this software for our business needs.,Compliment,im so glad we chose this software for our business needs.,2
It’s helped us to better manage our resources and improve our efficiency.,Compliment,its helped us to better manage our resources and improve our efficiency.,2
The software is simply incredible; it has transformed our business.,Compliment,the software is simply incredible it has transformed our business.,2
It’s a user-friendly and powerful tool that has improved our productivity.,Compliment,its a userfriendly and powerful tool that has improved our productivity.,2
This software is a true game changer for our company's operations.,Compliment,this software is a true game changer for our companys operations.,2
I'm very impressed with the level of support provided by the company.,Compliment,im very impressed with the level of support provided by the company.,2
"The software is easy to use and has a clean, intuitive interface.",Compliment,"the software is easy to use and has a clean, intuitive interface.",2
This software has exceeded my expectations in terms of functionality and ease of use.,Compliment,this software has exceeded my expectations in terms of functionality and ease of use.,2
It has significantly improved the accuracy and efficiency of our data entry.,Compliment,it has significantly improved the accuracy and efficiency of our data entry.,2
It’s a great tool for improving team collaboration and communication.,Compliment,its a great tool for improving team collaboration and communication.,2
We're extremely satisfied with the performance and reliability of the software.,Compliment,were extremely satisfied with the performance and reliability of the software.,2
The software is a valuable asset to our business and has helped us to grow.,Compliment,the software is a valuable asset to our business and has helped us to grow.,2
I'm incredibly happy with the purchase and would recommend it to anyone.,Compliment,im incredibly happy with the purchase and would recommend it to anyone.,2
This software has simplified our complex workflow and made our jobs easier.,Compliment,this software has simplified our complex workflow and made our jobs easier.,2
"The intuitive design makes it easy for anyone to use, regardless of technical skills.",Compliment,"the intuitive design makes it easy for anyone to use, regardless of technical skills.",2
It's a robust and reliable solution that has met all of our business needs.,Compliment,its a robust and reliable solution that has met all of our business needs.,2
I'm highly impressed with the overall quality and performance of the software.,Compliment,im highly impressed with the overall quality and performance of the software.,2
It's helped us to streamline our processes and improve our overall efficiency.,Compliment,its helped us to streamline our processes and improve our overall efficiency.,2
The software is constantly being updated and improved with new features.,Compliment,the software is constantly being updated and improved with new features.,2
This is the best software investment we've made in years!  Highly recommend!,Compliment,this is the best software investment weve made in years! highly recommend!,2
It has significantly improved our ability to track and manage our projects.,Compliment,it has significantly improved our ability to track and manage our projects.,2
The software is a powerful tool that has simplified our daily operations.,Compliment,the software is a powerful tool that has simplified our daily operations.,2
This software is easy to integrate with our existing systems.,Compliment,this software is easy to integrate with our existing systems.,2
I'm extremely satisfied with this purchase; it’s a great value.,Compliment,im extremely satisfied with this purchase its a great value.,2
It has significantly improved our team's ability to work together effectively.,Compliment,it has significantly improved our teams ability to work together effectively.,2
This software has exceeded our expectations in terms of functionality and performance.,Compliment,this software has exceeded our expectations in terms of functionality and performance.,2
"The software is very user-friendly and easy to learn, even for beginners.",Compliment,"the software is very userfriendly and easy to learn, even for beginners.",2
We are incredibly impressed with the software and the support we received.,Compliment,we are incredibly impressed with the software and the support we received.,2
It has improved our overall efficiency and reduced the amount of manual work.,Compliment,it has improved our overall efficiency and reduced the amount of manual work.,2
This software is an essential tool for any business looking to improve its operations.,Compliment,this software is an essential tool for any business looking to improve its operations.,2
It has helped us to achieve significant improvements in our productivity and efficiency.,Compliment,it has helped us to achieve significant improvements in our productivity and efficiency.,2
I would recommend this software to anyone looking for a reliable and efficient solution.,Compliment,i would recommend this software to anyone looking for a reliable and efficient solution.,2
It's a fantastic product that has exceeded all of our expectations.,Compliment,its a fantastic product that has exceeded all of our expectations.,2
This software has streamlined our processes and improved our workflow immensely.,Compliment,this software has streamlined our processes and improved our workflow immensely.,2
The software is incredibly reliable and rarely experiences any downtime.,Compliment,the software is incredibly reliable and rarely experiences any downtime.,2
It's a great tool for improving team collaboration and communication.,Compliment,its a great tool for improving team collaboration and communication.,2
The intuitive interface makes it easy to navigate and use.  Love it!,Compliment,the intuitive interface makes it easy to navigate and use. love it!,2
This software has made a significant positive impact on our business.,Compliment,this software has made a significant positive impact on our business.,2
"It's helped us to improve our efficiency, reduce costs, and increase productivity.",Compliment,"its helped us to improve our efficiency, reduce costs, and increase productivity.",2
I'm very happy with the purchase and highly recommend this software.,Compliment,im very happy with the purchase and highly recommend this software.,2
The software has simplified our work and made our daily tasks much easier.,Compliment,the software has simplified our work and made our daily tasks much easier.,2
This software is a must-have for any business seeking to improve efficiency.,Compliment,this software is a musthave for any business seeking to improve efficiency.,2
It has dramatically improved our ability to manage our data and information.,Compliment,it has dramatically improved our ability to manage our data and information.,2
We are incredibly pleased with the software and the support we received.,Compliment,we are incredibly pleased with the software and the support we received.,2
This software is a valuable asset to our company and has helped us to grow.,Compliment,this software is a valuable asset to our company and has helped us to grow.,2
I'm so much more productive since we switched.  Definitely worth the investment.,Compliment,im so much more productive since we switched. definitely worth the investment.,2
"The user interface is intuitive and easy to navigate, even for tech-challenged folks like me.",Compliment,"the user interface is intuitive and easy to navigate, even for techchallenged folks like me.",2
Customer support is phenomenal; they always respond quickly and helpfully.,Compliment,customer support is phenomenal they always respond quickly and helpfully.,2
This software has truly transformed how we manage our projects.,Compliment,this software has truly transformed how we manage our projects.,2
It's incredibly user-friendly and efficient. I love it!,Compliment,its incredibly userfriendly and efficient. i love it!,2
"The reporting features are fantastic, giving us clear and concise data.",Compliment,"the reporting features are fantastic, giving us clear and concise data.",2
"It integrates seamlessly with our existing systems, which was a huge plus.",Compliment,"it integrates seamlessly with our existing systems, which was a huge plus.",2
The training materials were comprehensive and easy to follow.,Compliment,the training materials were comprehensive and easy to follow.,2
I appreciate the constant updates and improvements to the software.,Compliment,i appreciate the constant updates and improvements to the software.,2
"It's robust, reliable, and a pleasure to work with.",Compliment,"its robust, reliable, and a pleasure to work with.",2
Our team is much more collaborative thanks to this software.,Compliment,our team is much more collaborative thanks to this software.,2
The software is incredibly versatile and adaptable to our specific needs.,Compliment,the software is incredibly versatile and adaptable to our specific needs.,2
I'm impressed by the level of detail and thoughtfulness in the design.,Compliment,im impressed by the level of detail and thoughtfulness in the design.,2
It's a game-changer for our small business.,Compliment,its a gamechanger for our small business.,2
The pricing is reasonable for the value it provides.,Compliment,the pricing is reasonable for the value it provides.,2
It's made a noticeable difference in our bottom line.,Compliment,its made a noticeable difference in our bottom line.,2
I highly recommend this software to anyone looking to improve efficiency.,Compliment,i highly recommend this software to anyone looking to improve efficiency.,2
"It's intuitive and powerful, a great combination.",Compliment,"its intuitive and powerful, a great combination.",2
This software has simplified complex tasks.,Compliment,this software has simplified complex tasks.,2
It's a significant upgrade from our previous system.,Compliment,its a significant upgrade from our previous system.,2
Great value for the price.  Highly recommend!,Compliment,great value for the price. highly recommend!,2
It's easy to learn and even easier to use.,Compliment,its easy to learn and even easier to use.,2
This software has improved our communication significantly.,Compliment,this software has improved our communication significantly.,2
It's a reliable and trustworthy platform.,Compliment,its a reliable and trustworthy platform.,2
The developers clearly listened to user feedback.,Compliment,the developers clearly listened to user feedback.,2
This software is a real time-saver.,Compliment,this software is a real timesaver.,2
I'm incredibly impressed with its functionality.,Compliment,im incredibly impressed with its functionality.,2
It's a powerful tool that's easy to master.,Compliment,its a powerful tool thats easy to master.,2
The support team is always ready to help.,Compliment,the support team is always ready to help.,2
I love the clean and modern design.,Compliment,i love the clean and modern design.,2
This software has boosted our team's morale.,Compliment,this software has boosted our teams morale.,2
It's incredibly flexible and customizable.,Compliment,its incredibly flexible and customizable.,2
A must-have for any growing business.,Compliment,a musthave for any growing business.,2
It’s changed our business for the better.,Compliment,its changed our business for the better.,2
Makes managing our clients so much easier.,Compliment,makes managing our clients so much easier.,2
So much better than our previous software!,Compliment,so much better than our previous software!,2
It simplifies even the most complex tasks.,Compliment,it simplifies even the most complex tasks.,2
Really improved our team's productivity.,Compliment,really improved our teams productivity.,2
I can't believe how much this software helps.,Compliment,i cant believe how much this software helps.,2
Definitely worth the investment in time and money.,Compliment,definitely worth the investment in time and money.,2
The features are well thought out and user-friendly.,Compliment,the features are well thought out and userfriendly.,2
Excellent customer service.  Always quick to respond.,Compliment,excellent customer service. always quick to respond.,2
Love the integration with other apps.,Compliment,love the integration with other apps.,2
A great improvement on our old system.,Compliment,a great improvement on our old system.,2
It's intuitive and powerful at the same time.,Compliment,its intuitive and powerful at the same time.,2
It's a breath of fresh air compared to other options.,Compliment,its a breath of fresh air compared to other options.,2
The reporting tools are excellent for analysis.,Compliment,the reporting tools are excellent for analysis.,2
It’s streamlined our entire workflow.,Compliment,its streamlined our entire workflow.,2
Much more efficient than our previous solution.,Compliment,much more efficient than our previous solution.,2
Saves me hours each week!  Love it!,Compliment,saves me hours each week! love it!,2
This software is a game changer for our team.,Compliment,this software is a game changer for our team.,2
It's incredibly reliable and consistent.,Compliment,its incredibly reliable and consistent.,2
Highly recommend this software to anyone.,Compliment,highly recommend this software to anyone.,2
Absolutely love the ease of use.,Compliment,absolutely love the ease of use.,2
This has significantly improved our accuracy.,Compliment,this has significantly improved our accuracy.,2
The training was helpful and informative.,Compliment,the training was helpful and informative.,2
A fantastic product.  So glad we found it!,Compliment,a fantastic product. so glad we found it!,2
I'm so much more organized now.,Compliment,im so much more organized now.,2
Excellent product.  Highly recommended.,Compliment,excellent product. highly recommended.,2
It's made a huge difference in our efficiency.,Compliment,its made a huge difference in our efficiency.,2
A worthwhile investment for any business.,Compliment,a worthwhile investment for any business.,2
This software is worth every penny.,Compliment,this software is worth every penny.,2
"So easy to use, even for beginners.",Compliment,"so easy to use, even for beginners.",2
It’s really helped us grow our business.,Compliment,its really helped us grow our business.,2
I feel so much more confident using this software.,Compliment,i feel so much more confident using this software.,2
It's a complete game changer for us.,Compliment,its a complete game changer for us.,2
This software has been a lifesaver!,Compliment,this software has been a lifesaver!,2
It's helped improve our bottom line.,Compliment,its helped improve our bottom line.,2
Super intuitive and user-friendly.,Compliment,super intuitive and userfriendly.,2
It's the best software we've used in years.,Compliment,its the best software weve used in years.,2
Very happy with this purchase.,Compliment,very happy with this purchase.,2
A big improvement on our old software.,Compliment,a big improvement on our old software.,2
It's powerful yet simple to use.,Compliment,its powerful yet simple to use.,2
This software has completely transformed our work.,Compliment,this software has completely transformed our work.,2
Our team is loving this new software.,Compliment,our team is loving this new software.,2
I highly recommend this product.,Compliment,i highly recommend this product.,2
It's a great value for the money.,Compliment,its a great value for the money.,2
It's improved our communication immensely.,Compliment,its improved our communication immensely.,2
This software is a must-have for any business.,Compliment,this software is a musthave for any business.,2
So glad we made this investment.,Compliment,so glad we made this investment.,2
Fantastic software – highly recommend.,Compliment,fantastic software highly recommend.,2
This is a truly excellent software product.,Compliment,this is a truly excellent software product.,2
Our team is much more efficient now.,Compliment,our team is much more efficient now.,2
"It's simple, effective and user-friendly.",Compliment,"its simple, effective and userfriendly.",2
It's integrated seamlessly with our existing systems.,Compliment,its integrated seamlessly with our existing systems.,2
I can't imagine working without this software now.,Compliment,i cant imagine working without this software now.,2
It’s significantly improved our productivity.,Compliment,its significantly improved our productivity.,2
The updates are frequent and improve the software constantly.,Compliment,the updates are frequent and improve the software constantly.,2
A great software solution for our needs.,Compliment,a great software solution for our needs.,2
Easy to use and very effective.  I highly recommend it.,Compliment,easy to use and very effective. i highly recommend it.,2
It makes our work so much easier!,Compliment,it makes our work so much easier!,2
This software is a total game changer!,Compliment,this software is a total game changer!,2
Definitely a worthwhile investment.,Compliment,definitely a worthwhile investment.,2
Great software for team collaboration.,Compliment,great software for team collaboration.,2
It's made a real difference in our workflow.,Compliment,its made a real difference in our workflow.,2
I love the ease of use and powerful features.,Compliment,i love the ease of use and powerful features.,2
The support team is fantastic.,Compliment,the support team is fantastic.,2
This software has simplified our processes.,Compliment,this software has simplified our processes.,2
It's a truly excellent product.,Compliment,its a truly excellent product.,2
Great features and excellent customer support.,Compliment,great features and excellent customer support.,2
This software has exceeded my expectations.,Compliment,this software has exceeded my expectations.,2
Very intuitive and easy to learn.,Compliment,very intuitive and easy to learn.,2
It’s incredibly powerful and versatile.,Compliment,its incredibly powerful and versatile.,2
This software is a great asset to our company.,Compliment,this software is a great asset to our company.,2
I'm extremely happy with this purchase.,Compliment,im extremely happy with this purchase.,2
It's made our lives so much easier.,Compliment,its made our lives so much easier.,2
Highly recommend this software.,Compliment,highly recommend this software.,2
It's helped us improve our customer service.,Compliment,its helped us improve our customer service.,2
A fantastic tool for any business.,Compliment,a fantastic tool for any business.,2
This software has improved our efficiency dramatically.,Compliment,this software has improved our efficiency dramatically.,2
The best business software I've ever used.,Compliment,the best business software ive ever used.,2
It's a joy to work with.,Compliment,its a joy to work with.,2
It's completely changed the way we do things.,Compliment,its completely changed the way we do things.,2
This software is truly amazing.,Compliment,this software is truly amazing.,2
"It's simple, yet powerful.",Compliment,"its simple, yet powerful.",2
This software is a great investment.,Compliment,this software is a great investment.,2
I'm very impressed with this software.,Compliment,im very impressed with this software.,2
It makes my job so much easier.,Compliment,it makes my job so much easier.,2
This software has improved our workflow significantly.,Compliment,this software has improved our workflow significantly.,2
It's a fantastic tool for project management.,Compliment,its a fantastic tool for project management.,2
The software is incredibly user-friendly.,Compliment,the software is incredibly userfriendly.,2
It's a great solution for our business needs.,Compliment,its a great solution for our business needs.,2
I love how efficient this software is.,Compliment,i love how efficient this software is.,2
It's been a game changer for our company.,Compliment,its been a game changer for our company.,2
It's easy to learn and use.,Compliment,its easy to learn and use.,2
I'm very happy with my purchase.,Compliment,im very happy with my purchase.,2
It's a fantastic software product.,Compliment,its a fantastic software product.,2
Highly recommended!,Compliment,highly recommended!,2
This software is amazing!,Compliment,this software is amazing!,2
It's helped us grow our business.,Compliment,its helped us grow our business.,2
Our team is more productive now.,Compliment,our team is more productive now.,2
This software is a real asset.,Compliment,this software is a real asset.,2
This software is top-notch.,Compliment,this software is topnotch.,2
It has streamlined our business processes.,Compliment,it has streamlined our business processes.,2
I am very impressed with the quality of this software.,Compliment,i am very impressed with the quality of this software.,2
It's intuitive and effective.,Compliment,its intuitive and effective.,2
A really great product!,Compliment,a really great product!,2
It's a great investment.,Compliment,its a great investment.,2
This software is a lifesaver for our team.,Compliment,this software is a lifesaver for our team.,2
I'm extremely satisfied with this software.,Compliment,im extremely satisfied with this software.,2
It's user-friendly and powerful.,Compliment,its userfriendly and powerful.,2
This software is simply the best.,Compliment,this software is simply the best.,2
It's helped us achieve more.,Compliment,its helped us achieve more.,2
Highly recommend it!,Compliment,highly recommend it!,2
This software has streamlined our workflow immensely.  It's a game changer for our team.,Compliment,this software has streamlined our workflow immensely. its a game changer for our team.,2
I love how intuitive this software is.  Even our least tech-savvy employees picked it up quickly.,Compliment,i love how intuitive this software is. even our least techsavvy employees picked it up quickly.,2
The customer support is exceptional. They always resolve issues promptly and efficiently.,Compliment,the customer support is exceptional. they always resolve issues promptly and efficiently.,2
Seriously impressed with the features this software offers. It's worth every penny.,Compliment,seriously impressed with the features this software offers. its worth every penny.,2
This has significantly improved our team's productivity. We're getting so much more done now.,Compliment,this has significantly improved our teams productivity. were getting so much more done now.,2
The reporting features are fantastic.  It gives us the data we need to make informed decisions.,Compliment,the reporting features are fantastic. it gives us the data we need to make informed decisions.,2
I've been using this software for months and I'm still finding new things I love about it.,Compliment,ive been using this software for months and im still finding new things i love about it.,2
This software has made my job so much easier. I can finally focus on the important tasks.,Compliment,this software has made my job so much easier. i can finally focus on the important tasks.,2
