query,category
"The software crashed unexpectedly, causing us to lose important unsaved data.  This is unacceptable.",Technical Problem
The slow performance of the software is affecting our ability to meet deadlines.  We need improvement.,Technical Problem
"We're encountering frequent database errors, impacting our ability to access and manage data.  It's unreliable.",Technical Problem
The integration failure with our external database is causing significant data discrepancies.  We need a solution.,Technical Problem
"The user interface is confusing and difficult to learn, resulting in low user adoption.  It's badly designed.",Technical Problem
The software is extremely buggy and unstable.  We've experienced numerous crashes and data loss.  It's a disaster.,Technical Problem
"The software is too slow to be useful, even on high-powered machines.  Optimization is needed.",Technical Problem
The constant error messages are disrupting our workflow and affecting our productivity.  They need to be fixed.,Technical Problem
"There's a significant bug in the reporting module, causing inaccurate data to be displayed.  It’s unusable.",Technical Problem
"The API calls are consistently timing out, making it impossible to integrate with other systems.  It’s a mess.",Technical Problem
The application's poor performance is negatively impacting our overall business efficiency.  This has to be fixed.,Technical Problem
"The software crashed mid-transaction, leaving me with a half-completed order and no way to recover it.  Frustrating!",Technical Problem
Slow performance is making the program almost unusable.  It takes ages to load simple reports.,Technical Problem
Got an error code 404 when trying to access a crucial feature.  Completely unhelpful error message.,Technical Problem
"The API integration with our CRM is failing frequently, causing data inconsistencies.  Needs urgent fixing.",Technical Problem
This bug keeps deleting my saved settings every time I close the program.  Very annoying.,Technical Problem
Experienced a major glitch that scrambled my data.  Thankfully I had a backup.,Technical Problem
The software became unresponsive after an update.  Had to restart my whole computer.,Technical Problem
I'm getting constant integration failure messages with our accounting software.  This is seriously impacting our workflow.,Technical Problem
The search function is completely broken; I can't find anything.  It's useless.,Technical Problem
This update introduced a new bug that prevents me from exporting data.  Completely unacceptable.,Technical Problem
Unresponsive interface is making it impossible to complete my work.  Needs immediate attention.,Technical Problem
"Error code 1201 keeps popping up, preventing access to key features.  What does it even mean?",Technical Problem
Slow performance has become unbearable.  It's impacting my productivity drastically.,Technical Problem
"The software crashed during a critical meeting, ruining the presentation.  Unforgivable.",Technical Problem
The user interface is clunky and unintuitive.  It's difficult to navigate basic functions.,Technical Problem
I've experienced multiple instances of data corruption.  I'm worried about losing important information.,Technical Problem
Frequent crashes are making this software unreliable.  I'm considering switching providers.,Technical Problem
"The program froze completely, losing all my unsaved work.  Absolutely infuriating.",Technical Problem
Integration failure with our marketing automation platform is a major issue.  We need this fixed ASAP.,Technical Problem
There's a glitch in the reporting feature that's skewing the data.  It's producing incorrect results.,Technical Problem
The program keeps unexpectedly closing.  It's incredibly disruptive.,Technical Problem
I'm getting a persistent error message I can't find information on.  Poor documentation.,Technical Problem
The new update broke the import functionality.  It's now impossible to upload data.,Technical Problem
I've encountered a bug that prevents me from saving attachments.  This is essential functionality.,Technical Problem
Slow loading times make the program painfully slow.  This is unacceptable.,Technical Problem
"The system froze during peak hours, causing a major disruption.  Completely unreliable.",Technical Problem
The API is constantly returning errors.  This is crippling our workflow.,Technical Problem
A recent update introduced a bug that's causing random crashes.  Roll it back!,Technical Problem
The software keeps losing my connection.  This happens multiple times a day.,Technical Problem
There's a glitch in the billing system that's causing inaccurate invoices.  This is a big problem.,Technical Problem
I've lost hours of work due to unexpected crashes and errors.  This software is a nightmare.,Technical Problem
"The software is constantly lagging, making it impossible to work efficiently.  Fix this now!",Technical Problem
The user interface is confusing and difficult to use.  Poor design.,Technical Problem
Integration with our existing systems has been nothing but problems.  It's a disaster.,Technical Problem
The application is incredibly unresponsive.  It takes minutes for anything to load.,Technical Problem
The program frequently crashes during data entry.  This is losing me valuable time.,Technical Problem
"I've reported several bugs, but none have been fixed.  What's the point of feedback?",Technical Problem
This software is unstable and unreliable.  I would not recommend it to anyone.,Technical Problem
The update introduced a new bug that corrupts my data files.  This is a serious security flaw.,Technical Problem
"The program frequently freezes, requiring a forced restart.  This happens several times a day.",Technical Problem
I'm getting an error code that I can't find anywhere online.  Absolutely useless.,Technical Problem
The software's performance is abysmal.  It's incredibly slow and laggy.,Technical Problem
There's a glitch in the calendar that's causing scheduling conflicts.  This is a critical error.,Technical Problem
The API documentation is inadequate and unhelpful.  Makes troubleshooting incredibly difficult.,Technical Problem
"The integration failure with our email marketing platform is costing us business.  It needs a fix, now.",Technical Problem
This bug prevents me from accessing certain features.  This is limiting my work.,Technical Problem
Slow response times are making the software unusable.  I'm wasting too much time waiting.,Technical Problem
The program crashed while I was processing a large data set.  All my work was lost.,Technical Problem
This software is a constant source of frustration.  I'm ready to switch.,Technical Problem
"The user interface is so clunky, it's nearly impossible to use.  This needs a redesign.",Technical Problem
The reporting feature is buggy and unreliable.  It produces inaccurate and inconsistent data.,Technical Problem
The software is constantly throwing error messages.  It's a disaster.,Technical Problem
The API is poorly designed and difficult to work with.  It's frustrating to use.,Technical Problem
I've experienced multiple instances of data loss due to software glitches.  This is unacceptable.,Technical Problem
"The software is frequently unresponsive, making it impossible to get anything done.  Needs fixing.",Technical Problem
I'm getting an error message I don't understand.  The help documentation is no help.,Technical Problem
"The program's performance is dramatically slow, even on a high-powered computer.  This is a hardware problem disguised as software.",Technical Problem
The integration with our existing systems is problematic and prone to errors.  It needs serious attention.,Technical Problem
"The software crashed during a critical update, leaving me with a corrupted database.  Total nightmare.",Technical Problem
I've experienced several instances of unexpected shutdowns.  This is impacting my productivity significantly.,Technical Problem
This bug prevents me from logging in.  I've tried everything.,Technical Problem
There's a glitch in the workflow that causes duplicate entries.  This is causing data inconsistencies.,Technical Problem
"The API limits are too restrictive, hindering my ability to access data.  Poor design.",Technical Problem
Slow performance during peak hours is impacting business operations.  This is unacceptable.,Technical Problem
The unresponsive interface is making it nearly impossible to complete simple tasks.  Fix this.,Technical Problem
"Error code 500 keeps popping up, blocking access to crucial functions.  It’s driving me mad.",Technical Problem
The software crashed after only 15 minutes of use.  Very unreliable.,Technical Problem
"The program frequently freezes, requiring a manual restart.  It's costing me valuable time.",Technical Problem
There's a bug in the search function that returns inaccurate results.  Needs immediate attention.,Technical Problem
Integration failure with our payment gateway is causing significant financial issues.  This is a disaster.,Technical Problem
This glitch prevents me from saving my progress.  All my work is lost!,Technical Problem
"The software is slow and clunky, making it a tedious experience.  I hate using it.",Technical Problem
I'm encountering frequent error messages and unexpected shutdowns.  This software is terrible.,Technical Problem
The API key is constantly expiring.  It's causing major disruptions.,Technical Problem
Slow performance is a significant hindrance to productivity.  It's frustrating and time-consuming.,Technical Problem
"The application crashes several times a day, completely halting my workflow.  This is unusable.",Technical Problem
The UI is confusing and unintuitive.  It's almost impossible to learn.,Technical Problem
There's a critical bug in the reporting system that's displaying incorrect data.  This is a serious issue.,Technical Problem
The integration failure with our sales platform is severely impacting our revenue.  Needs immediate attention.,Technical Problem
The software is extremely slow and unresponsive.  I'm considering switching to a competitor.,Technical Problem
"The program crashed unexpectedly, deleting all my unsaved work.  Completely unacceptable.",Technical Problem
This bug is making it impossible to complete my tasks.  It needs to be fixed immediately.,Technical Problem
The API is unreliable and inconsistent.  It's causing many headaches.,Technical Problem
Slow performance during peak times is causing significant delays.  This is a serious problem.,Technical Problem
"The software frequently becomes unresponsive, requiring me to force quit.  This is disruptive.",Technical Problem
I've experienced many bugs since the last update.  Please fix them!,Technical Problem
The system crashed and lost all my progress.  This is outrageous!,Technical Problem
The software is difficult to use and poorly designed.  It's a terrible experience.,Technical Problem
There is a bug in the calculation function that's producing incorrect results.  Unacceptable.,Technical Problem
Integration with external databases is problematic and prone to errors.  This is a major concern.,Technical Problem
The slow performance is completely unacceptable.  This needs to be addressed urgently.,Technical Problem
"The software is constantly crashing, making it impossible to use reliably.  I'm looking for a replacement.",Technical Problem
I'm getting a cryptic error message with no explanation.  Very unhelpful.,Technical Problem
The software is unreliable and prone to glitches.  I'm losing confidence in it.,Technical Problem
"The API calls are extremely slow, causing significant delays.  This needs improving.",Technical Problem
"This program frequently freezes, forcing me to restart my computer.  Very frustrating.",Technical Problem
I'm encountering unexpected errors and crashes.  This software is a complete mess.,Technical Problem
The user interface is cluttered and confusing.  It needs simplification.,Technical Problem
There's a bug in the data import function that's causing corrupted files.  This is a big problem.,Technical Problem
The integration with our marketing platform is a nightmare.  It's causing major issues.,Technical Problem
The software is unbearably slow.  This is affecting my ability to work efficiently.,Technical Problem
The system crashed and I lost hours of work.  I am furious!,Technical Problem
This bug prevents me from using a critical feature.  It needs to be fixed immediately.,Technical Problem
"The API is poorly documented, making it incredibly difficult to use.  Poor support.",Technical Problem
The software's slow performance is detrimental to my workflow.  This is unacceptable.,Technical Problem
The program crashes frequently and unexpectedly.  It's completely unreliable.,Technical Problem
I'm encountering numerous errors and bugs.  This software is a disaster.,Technical Problem
The UI is clunky and unintuitive.  It needs a major redesign.,Technical Problem
The integration with other applications is failing constantly.  It's frustrating and time-consuming.,Technical Problem
"The software is extremely slow, even on a high-end machine.  This needs to be fixed.",Technical Problem
The application crashed unexpectedly during a critical task.  I lost all my data.,Technical Problem
The program frequently freezes up and becomes unresponsive.  Very annoying.,Technical Problem
I'm getting an error code I can't find anywhere online.  Poor support.,Technical Problem
This bug prevents me from accessing important files.  This is critical.,Technical Problem
The software is slow and cumbersome.  It's not user-friendly at all.,Technical Problem
The API integration is constantly failing.  It's causing significant delays.,Technical Problem
The software crashes randomly and without warning.  This is unacceptable.,Technical Problem
I've experienced numerous glitches and bugs since the last update.  Poor quality control.,Technical Problem
The software is incredibly slow and unresponsive.  It's hindering my productivity.,Technical Problem
The system crashed and lost all my unsaved work.  I'm very disappointed.,Technical Problem
This bug prevents me from accessing specific features.  This is frustrating.,Technical Problem
The API documentation is confusing and unhelpful.  Poor design.,Technical Problem
The slow performance is making the software almost unusable.  It's a waste of money.,Technical Problem
The program crashed during a crucial moment.  I'm very upset.,Technical Problem
This bug is causing data inconsistencies and errors.  Needs urgent attention.,Technical Problem
The software's integration with other systems is problematic.  This needs fixing immediately.,Technical Problem
The slow loading times are unacceptable.  This needs to be addressed.,Technical Problem
The application is constantly crashing and freezing.  It's driving me crazy.,Technical Problem
The user interface is poorly designed and confusing.  It's difficult to navigate.,Technical Problem
There's a bug in the reporting module that's producing inaccurate data.  This is a serious flaw.,Technical Problem
The integration failure with our CRM is causing data loss and inconsistencies.  This needs a fix.,Technical Problem
The software is very slow and unresponsive.  It's frustrating to use.,Technical Problem
The program crashed unexpectedly and lost all my data.  I'm devastated.,Technical Problem
This bug prevents me from completing critical tasks.  It needs to be fixed ASAP.,Technical Problem
The API is poorly implemented and difficult to use.  Poor design.,Technical Problem
The software's slow performance is affecting my productivity.  It needs improvement.,Technical Problem
The application is constantly crashing and freezing.  It's unreliable and unusable.,Technical Problem
The user interface is not intuitive and very difficult to navigate.  Needs redesign.,Technical Problem
This bug is causing incorrect calculations and data errors.  Urgent action required.,Technical Problem
The integration with other software is unreliable and causes frequent issues.  Needs to be fixed.,Technical Problem
"The software is incredibly slow, even on a powerful computer.  This is unacceptable.",Technical Problem
The program crashed and I lost all my unsaved work.  I'm extremely frustrated.,Technical Problem
This bug is preventing me from accessing essential features.  This is a major problem.,Technical Problem
This software is a lifesaver!  My workflow is so much smoother now.,Compliment
I love how intuitive this program is.  I picked it up in minutes.,Compliment
The support team was incredibly helpful.  They solved my problem quickly.,Compliment
Seriously user-friendly.  Even my tech-challenged colleagues are using it.,Compliment
It's streamlined my entire process.  I'm getting so much more done.,Compliment
What a time-saver! I can't believe how much faster my work is now.,Compliment
This software is incredibly intuitive and easy to navigate. Highly recommend!,Compliment
Their customer service is top-notch.  They always respond promptly and efficiently.,Compliment
This has completely revolutionized our workflow.  It's made everything so much easier.,Compliment
I'm so much more productive now.  Thanks to this amazing software!,Compliment
The interface is clean and simple.  It's a pleasure to use.,Compliment
"Great software, even better customer support.  A winning combination.",Compliment
It's made my job so much easier and less stressful.  I'm thankful for this product.,Compliment
Such a time saver! I've gained back hours in my week.,Compliment
The training videos were incredibly helpful.  I was up and running in no time.,Compliment
This software is a game-changer for my business.  I can't recommend it enough.,Compliment
"I used to dread this part of my job, but now it's a breeze.",Compliment
The support team went above and beyond to help me.  I appreciate their dedication.,Compliment
"It's so easy to use, even on my phone!  Perfect for on-the-go access.",Compliment
This software has significantly improved my efficiency.  A worthwhile investment.,Compliment
"I was skeptical at first, but I'm completely sold.  It's fantastic!",Compliment
"It's intuitive, efficient, and just plain works well.  Highly recommend!",Compliment
My team loves this software.  It's made collaboration so much easier.,Compliment
The updates are always seamless and improve the product even further.,Compliment
This software has increased my productivity dramatically.  A great tool.,Compliment
I'm so impressed with the ease of use.  It's incredibly straightforward.,Compliment
The customer support is always friendly and helpful.  A true asset.,Compliment
This software has saved my business countless hours.  A must-have.,Compliment
It's a game changer! My team is much more efficient now.,Compliment
It's so much easier to manage my projects now.  Thank you!,Compliment
The reports are clear and easy to understand.  Very helpful.,Compliment
This software is incredibly reliable and consistent.  Always works perfectly.,Compliment
I love the simplicity of the design.  It’s easy on the eyes and brain.,Compliment
I highly recommend this software to anyone looking to improve their workflow.,Compliment
"Excellent software, excellent support. What more could you ask for?",Compliment
This has truly simplified our operations.  We are so grateful.,Compliment
My team and I are extremely happy with this software.  It's a perfect fit.,Compliment
It's incredibly efficient and helps me stay organized.  Highly recommend.,Compliment
This software has made a huge difference in my day-to-day work.,Compliment
I appreciate the consistent updates and improvements to the software.,Compliment
The interface is very user-friendly and intuitive.  I love it!,Compliment
It's a powerful tool that's surprisingly easy to learn and use.,Compliment
It's a breath of fresh air compared to the clunky software I used before.,Compliment
"Great software, and the price is very reasonable.  A steal!",Compliment
The onboarding process was incredibly smooth.  Everything was clear and concise.,Compliment
This software makes complex tasks seem easy.  A true game changer.,Compliment
"It’s simplified my workflow significantly, saving me valuable time.",Compliment
I can’t believe how much this software has improved my productivity.,Compliment
The customer support is quick to respond and very knowledgeable.,Compliment
This is the best business software I have ever used.  I'm so impressed!,Compliment
"The intuitive design makes it a joy to use, even for beginners.",Compliment
It’s helped me streamline my processes and reduce errors.,Compliment
This software is incredibly reliable and rarely gives me any trouble.,Compliment
My team’s collaboration has improved significantly thanks to this software.,Compliment
I'm so glad I made the switch to this software.  It's fantastic.,Compliment
This software is worth every penny.  It’s a great investment.,Compliment
"I'm so much more efficient now, thanks to this time-saving software.",Compliment
It's incredibly easy to learn and master.  Highly recommended.,Compliment
The support team is always available and ready to assist.  Top-notch service.,Compliment
This software has significantly improved my work-life balance.,Compliment
A huge time-saver!  I'm getting so much more done in less time.,Compliment
The software is so easy to use that I was able to train my team quickly.,Compliment
It's made a real difference in our overall productivity.,Compliment
It's a truly intuitive and easy-to-use piece of software.  A must-have.,Compliment
It has really helped me to focus on the important tasks.,Compliment
I appreciate the regular updates and improvements to the platform.,Compliment
This software is a must-have for anyone seeking to improve their efficiency.,Compliment
"It integrates seamlessly with other software I use, which is a big plus.",Compliment
"I was initially hesitant, but I'm so glad I gave this software a try.",Compliment
The reporting features are exceptionally helpful and well-designed.,Compliment
This software has exceeded my expectations in every way.,Compliment
"It's user-friendly, efficient, and cost-effective.  A great find!",Compliment
Customer support has always been readily available and helpful.,Compliment
I feel much more organized and in control of my work now.,Compliment
This software has made my job so much more enjoyable.,Compliment
The streamlined workflow has made my team much more efficient.,Compliment
It's so much easier to track progress and manage projects now.,Compliment
This software has greatly improved communication within our team.,Compliment
This product is a real game-changer for my small business.,Compliment
"The software is so intuitive, even my grandmother could use it!",Compliment
It’s a very user-friendly and easy-to-understand program.,Compliment
I would absolutely recommend this software to anyone.,Compliment
It has significantly reduced the amount of time I spend on admin tasks.,Compliment
This software is helping me to grow my business.,Compliment
I am incredibly satisfied with this software and its support team.,Compliment
The software's features are exactly what I needed for my business.,Compliment
It has made managing my clients so much easier.,Compliment
"The interface is clean and uncluttered, making it easy to navigate.",Compliment
This software has become an indispensable tool for my business.,Compliment
I'm so much more productive and less stressed since I started using it.,Compliment
It's been a pleasure working with this software.,Compliment
The team behind this software is truly dedicated to customer satisfaction.,Compliment
It's a highly effective tool that’s also incredibly easy to use.,Compliment
This is a great product that has significantly improved my workflow.,Compliment
The software's performance is consistently reliable and stable.,Compliment
It's a valuable tool that’s enhanced my overall productivity.,Compliment
I can't imagine working without this software now.,Compliment
It has saved me countless hours of tedious work.,Compliment
I'm incredibly impressed with the level of support provided.,Compliment
This software has made a remarkable difference to my business.,Compliment
The intuitive design makes it simple to learn and use effectively.,Compliment
I'm so glad I discovered this amazing software.,Compliment
The features are well thought out and very user-friendly.,Compliment
It’s a powerful tool that's surprisingly simple to use.,Compliment
It's a truly effective and efficient solution for my business needs.,Compliment
This software has streamlined my workflow and boosted my productivity.,Compliment
The customer service is top-notch and incredibly responsive.,Compliment
This software has been a game changer for our team.,Compliment
It is truly an intuitive and user-friendly application.,Compliment
It’s a pleasure using software that's both powerful and easy to navigate.,Compliment
This software is essential for anyone looking to optimize their workflow.,Compliment
The features are comprehensive and exceptionally well-designed.,Compliment
"I feel so much more confident in my work now, thanks to this software.",Compliment
This software is a powerful tool that's surprisingly accessible.,Compliment
It's made a significant positive impact on my business.,Compliment
The support team is extremely knowledgeable and helpful.,Compliment
I highly recommend this software to other business owners.,Compliment
It's incredibly versatile and adaptable to various business needs.,Compliment
This software has helped me to stay organized and focused.,Compliment
It's a valuable tool that has improved both my efficiency and accuracy.,Compliment
I'm incredibly impressed by the quality of this software.,Compliment
This software has exceeded all of my expectations.,Compliment
It's a user-friendly and effective solution to a lot of my problems.,Compliment
