query,category,query_clean,category_encoded
It doesn't support my preferred browser.  Browser incompatibility.,Technical Problem,it doesnt support my preferred browser. browser incompatibility.,4
The program unexpectedly shuts down without saving changes.  Data loss.,Technical Problem,the program unexpectedly shuts down without saving changes. data loss.,4
The software freezes up frequently during peak usage times.  Performance bottleneck.,Technical Problem,the software freezes up frequently during peak usage times. performance bottleneck.,4
It's very difficult to find a resolution for technical issues.  Poor customer support.,Technical Problem,its very difficult to find a resolution for technical issues. poor customer support.,4
The program is incredibly slow to respond to user input.  Lag issues.,Technical Problem,the program is incredibly slow to respond to user input. lag issues.,4
It takes forever to load the main interface.  Poor start-up time.,Technical Problem,it takes forever to load the main interface. poor startup time.,4
I'm getting strange characters in my reports.  Encoding problem.,Technical Problem,im getting strange characters in my reports. encoding problem.,4
It's generating nonsensical error messages.  Unclear error reporting.,Technical Problem,its generating nonsensical error messages. unclear error reporting.,4
The software isn't compatible with my company's firewall.  Security restrictions.,Technical Problem,the software isnt compatible with my companys firewall. security restrictions.,4
"I get a ""missing DLL"" error message.  Software installation problem.",Technical Problem,i get a missing dll error message. software installation problem.,4
The data isn't sorting correctly.  Sorting algorithm issue.,Technical Problem,the data isnt sorting correctly. sorting algorithm issue.,4
The calculations performed are consistently inaccurate.  Mathematical error.,Technical Problem,the calculations performed are consistently inaccurate. mathematical error.,4
My custom reports are not generating properly.  Report generation failure.,Technical Problem,my custom reports are not generating properly. report generation failure.,4
The software needs more detailed error logging.  Difficult to debug.,Technical Problem,the software needs more detailed error logging. difficult to debug.,4
It's missing essential features advertised in the product description.  Missing functionality.,Technical Problem,its missing essential features advertised in the product description. missing functionality.,4
The user interface is not accessible to users with disabilities.  Accessibility issues.,Technical Problem,the user interface is not accessible to users with disabilities. accessibility issues.,4
The program is extremely resource-intensive.  High system requirements.,Technical Problem,the program is extremely resourceintensive. high system requirements.,4
The help desk is unhelpful and unresponsive.  Poor customer support.,Technical Problem,the help desk is unhelpful and unresponsive. poor customer support.,4
The software is outdated and needs a major update.  Outdated technology.,Technical Problem,the software is outdated and needs a major update. outdated technology.,4
It frequently gets stuck on loading screens.  Loading issues.,Technical Problem,it frequently gets stuck on loading screens. loading issues.,4
The software is difficult to learn and use.  Steep learning curve.,Technical Problem,the software is difficult to learn and use. steep learning curve.,4
I experience frequent data corruption.  Data integrity concerns.,Technical Problem,i experience frequent data corruption. data integrity concerns.,4
It's constantly prompting me for updates.  Annoying update notifications.,Technical Problem,its constantly prompting me for updates. annoying update notifications.,4
The software is not optimized for my hardware.  Hardware incompatibility.,Technical Problem,the software is not optimized for my hardware. hardware incompatibility.,4
The export function is not working as expected.  Export failures.,Technical Problem,the export function is not working as expected. export failures.,4
It crashes when importing large files.  File import issues.,Technical Problem,it crashes when importing large files. file import issues.,4
The software is too buggy to use reliably.  Unstable software.,Technical Problem,the software is too buggy to use reliably. unstable software.,4
The customer support is slow to respond.  Unresponsive support.,Technical Problem,the customer support is slow to respond. unresponsive support.,4
The software hangs frequently.  Application hangs.,Technical Problem,the software hangs frequently. application hangs.,4
The features are not well-integrated.  Poor integration.,Technical Problem,the features are not wellintegrated. poor integration.,4
It has too many unnecessary features.  Bloated software.,Technical Problem,it has too many unnecessary features. bloated software.,4
The program is overly complex.  Complex software design.,Technical Problem,the program is overly complex. complex software design.,4
The software lacks proper error handling.  Poor error handling.,Technical Problem,the software lacks proper error handling. poor error handling.,4
The installation process is too complicated.  Complex installation.,Technical Problem,the installation process is too complicated. complex installation.,4
The documentation is insufficient.  Poor documentation.,Technical Problem,the documentation is insufficient. poor documentation.,4
I have experienced numerous crashes.  Frequent application crashes.,Technical Problem,i have experienced numerous crashes. frequent application crashes.,4
The program is very slow to load.  Slow application performance.,Technical Problem,the program is very slow to load. slow application performance.,4
The user interface is confusing.  Poor user interface design.,Technical Problem,the user interface is confusing. poor user interface design.,4
It's not intuitive to use.  Unintuitive design.,Technical Problem,its not intuitive to use. unintuitive design.,4
The software is not user-friendly.  Poor user experience.,Technical Problem,the software is not userfriendly. poor user experience.,4
It lacks basic features.  Missing basic functionality.,Technical Problem,it lacks basic features. missing basic functionality.,4
The program is very unstable.  Unstable application.,Technical Problem,the program is very unstable. unstable application.,4
It's unreliable and prone to errors.  Unreliable software.,Technical Problem,its unreliable and prone to errors. unreliable software.,4
The software is not well-designed.  Poor software design.,Technical Problem,the software is not welldesigned. poor software design.,4
It has serious performance issues.  Performance problems.,Technical Problem,it has serious performance issues. performance problems.,4
The software is difficult to install.  Difficult installation.,Technical Problem,the software is difficult to install. difficult installation.,4
The program requires too much memory.  High memory consumption.,Technical Problem,the program requires too much memory. high memory consumption.,4
It doesn't work as advertised.  False advertising.,Technical Problem,it doesnt work as advertised. false advertising.,4
The support team is unhelpful.  Poor customer support.,Technical Problem,the support team is unhelpful. poor customer support.,4
The updates are frequent and disruptive.  Frequent disruptive updates.,Technical Problem,the updates are frequent and disruptive. frequent disruptive updates.,4
The software is poorly documented.  Poor documentation.,Technical Problem,the software is poorly documented. poor documentation.,4
It's hard to troubleshoot problems.  Difficult troubleshooting.,Technical Problem,its hard to troubleshoot problems. difficult troubleshooting.,4
It takes a long time to learn how to use it.  Steep learning curve.,Technical Problem,it takes a long time to learn how to use it. steep learning curve.,4
The software is expensive and unreliable.  Expensive and unreliable software.,Technical Problem,the software is expensive and unreliable. expensive and unreliable software.,4
The features are poorly implemented.  Poor feature implementation.,Technical Problem,the features are poorly implemented. poor feature implementation.,4
The program is buggy and full of errors.  Buggy and error-prone software.,Technical Problem,the program is buggy and full of errors. buggy and errorprone software.,4
The user interface is outdated.  Outdated user interface.,Technical Problem,the user interface is outdated. outdated user interface.,4
The software is not compatible with my hardware.  Hardware incompatibility.,Technical Problem,the software is not compatible with my hardware. hardware incompatibility.,4
It's constantly freezing.  Frequent freezes.,Technical Problem,its constantly freezing. frequent freezes.,4
The program is too complex for the average user.  Complex for average users.,Technical Problem,the program is too complex for the average user. complex for average users.,4
It's difficult to understand.  Hard to understand.,Technical Problem,its difficult to understand. hard to understand.,4
The software has many limitations.  Many limitations.,Technical Problem,the software has many limitations. many limitations.,4
It crashes without warning.  Unexpected crashes.,Technical Problem,it crashes without warning. unexpected crashes.,4
The software is inconsistent.  Inconsistent software.,Technical Problem,the software is inconsistent. inconsistent software.,4
It's frustrating to use.  Frustrating user experience.,Technical Problem,its frustrating to use. frustrating user experience.,4
The program is not efficient.  Inefficient program.,Technical Problem,the program is not efficient. inefficient program.,4
It's time-consuming to use.  Time-consuming to use.,Technical Problem,its timeconsuming to use. timeconsuming to use.,4
The software has serious defects.  Serious software defects.,Technical Problem,the software has serious defects. serious software defects.,4
It doesn't work properly.  Malfunctioning software.,Technical Problem,it doesnt work properly. malfunctioning software.,4
The program is poorly tested.  Poorly tested software.,Technical Problem,the program is poorly tested. poorly tested software.,4
The software is a waste of money.  Waste of money.,Technical Problem,the software is a waste of money. waste of money.,4
"The software crashed mid-report, losing hours of work.  Very frustrating.",Technical Problem,"the software crashed midreport, losing hours of work. very frustrating.",4
"I kept getting a ""database error"" message, and support couldn't help.",Technical Problem,"i kept getting a database error message, and support couldnt help.",4
"The interface is clunky and unintuitive, leading to constant technical problems.",Technical Problem,"the interface is clunky and unintuitive, leading to constant technical problems.",4
"My system requirements met the minimum, yet the software ran incredibly slow.",Technical Problem,"my system requirements met the minimum, yet the software ran incredibly slow.",4
Spent an hour troubleshooting a simple export function.  Needs improvement.,Technical Problem,spent an hour troubleshooting a simple export function. needs improvement.,4
Unexpectedly high CPU usage caused my computer to freeze.,Technical Problem,unexpectedly high cpu usage caused my computer to freeze.,4
"The software randomly freezes, requiring a full restart.  This happens multiple times a day.",Technical Problem,"the software randomly freezes, requiring a full restart. this happens multiple times a day.",4
Integration with our existing CRM was a nightmare.,Technical Problem,integration with our existing crm was a nightmare.,4
The update completely broke the reporting module.  What a mess!,Technical Problem,the update completely broke the reporting module. what a mess!,4
It's constantly giving me error code 404.  No idea what to do.,Technical Problem,its constantly giving me error code 404. no idea what to do.,4
"The software is incompatible with my operating system, despite their claims.",Technical Problem,"the software is incompatible with my operating system, despite their claims.",4
I've lost data several times due to unexpected shutdowns.  Very unreliable.,Technical Problem,ive lost data several times due to unexpected shutdowns. very unreliable.,4
The user manual is unhelpful and outdated.  Poor documentation.,Technical Problem,the user manual is unhelpful and outdated. poor documentation.,4
The program frequently locks up when handling large datasets.,Technical Problem,the program frequently locks up when handling large datasets.,4
"Tried contacting support, but the wait times are unacceptable.",Technical Problem,"tried contacting support, but the wait times are unacceptable.",4
Couldn't figure out how to use the advanced features; the instructions are vague.,Technical Problem,couldnt figure out how to use the advanced features the instructions are vague.,4
"My subscription keeps getting deactivated, even though I've paid.",Technical Problem,"my subscription keeps getting deactivated, even though ive paid.",4
"Constantly getting ""permission denied"" errors, even with admin rights.",Technical Problem,"constantly getting permission denied errors, even with admin rights.",4
"The software is prone to glitches, especially when multitasking.",Technical Problem,"the software is prone to glitches, especially when multitasking.",4
There's a persistent bug that prevents me from saving files.,Technical Problem,theres a persistent bug that prevents me from saving files.,4
It's incredibly difficult to navigate the program's settings.,Technical Problem,its incredibly difficult to navigate the programs settings.,4
The software's performance is significantly degraded after the latest update.,Technical Problem,the softwares performance is significantly degraded after the latest update.,4
"I received an error message saying ""invalid license,"" but my license is valid.",Technical Problem,"i received an error message saying invalid license, but my license is valid.",4
Exporting data is extremely slow and often fails completely.,Technical Problem,exporting data is extremely slow and often fails completely.,4
The search function is broken; it rarely finds what I'm looking for.,Technical Problem,the search function is broken it rarely finds what im looking for.,4
The program crashes every time I try to print a report.,Technical Problem,the program crashes every time i try to print a report.,4
Printing from the software is a complete disaster.,Technical Problem,printing from the software is a complete disaster.,4
I'm constantly battling pop-up errors.  It's driving me crazy.,Technical Problem,im constantly battling popup errors. its driving me crazy.,4
The program keeps asking me to re-enter my login credentials.,Technical Problem,the program keeps asking me to reenter my login credentials.,4
"The software is extremely resource-intensive, making my computer lag.",Technical Problem,"the software is extremely resourceintensive, making my computer lag.",4
It's difficult to customize the software to fit our business needs.,Technical Problem,its difficult to customize the software to fit our business needs.,4
It keeps deleting my saved preferences without any warning.,Technical Problem,it keeps deleting my saved preferences without any warning.,4
The help files are unhelpful and lack clear solutions.,Technical Problem,the help files are unhelpful and lack clear solutions.,4
The software is too complex for its intended purpose.,Technical Problem,the software is too complex for its intended purpose.,4
Getting a response from tech support is near impossible.,Technical Problem,getting a response from tech support is near impossible.,4
I can't access certain features due to an unknown error.,Technical Problem,i cant access certain features due to an unknown error.,4
The software is full of bugs and requires constant troubleshooting.,Technical Problem,the software is full of bugs and requires constant troubleshooting.,4
The user interface needs a major overhaul; it's so confusing.,Technical Problem,the user interface needs a major overhaul its so confusing.,4
"It's unstable and crashes frequently, leading to lost productivity.",Technical Problem,"its unstable and crashes frequently, leading to lost productivity.",4
The program doesn't work properly with my firewall.,Technical Problem,the program doesnt work properly with my firewall.,4
It's impossible to uninstall the software cleanly.,Technical Problem,its impossible to uninstall the software cleanly.,4
The application is incredibly slow to load and respond.,Technical Problem,the application is incredibly slow to load and respond.,4
The software frequently becomes unresponsive.,Technical Problem,the software frequently becomes unresponsive.,4
I get a blank screen whenever I try to open a specific file.,Technical Problem,i get a blank screen whenever i try to open a specific file.,4
The formatting is consistently off in the generated reports.,Technical Problem,the formatting is consistently off in the generated reports.,4
The software is incompatible with my company's network security.,Technical Problem,the software is incompatible with my companys network security.,4
It's completely unusable due to the constant errors.,Technical Problem,its completely unusable due to the constant errors.,4
"I'm constantly getting alerts for minor, non-critical issues.",Technical Problem,"im constantly getting alerts for minor, noncritical issues.",4
The program struggles to handle more than a few hundred records.,Technical Problem,the program struggles to handle more than a few hundred records.,4
"I've tried everything, and I still can't get the software to work.",Technical Problem,"ive tried everything, and i still cant get the software to work.",4
"Received a ""server error"" and couldn't access my data.",Technical Problem,received a server error and couldnt access my data.,4
This software is a complete waste of money; it's constantly broken.,Technical Problem,this software is a complete waste of money its constantly broken.,4
The software keeps throwing up obscure error messages.,Technical Problem,the software keeps throwing up obscure error messages.,4
It's too difficult to use for someone without a technical background.,Technical Problem,its too difficult to use for someone without a technical background.,4
I've lost faith in this software; it's completely unreliable.,Technical Problem,ive lost faith in this software its completely unreliable.,4
The auto-save function doesn't work as advertised.,Technical Problem,the autosave function doesnt work as advertised.,4
The software frequently gives me incorrect data.,Technical Problem,the software frequently gives me incorrect data.,4
The program is unstable and prone to data corruption.,Technical Problem,the program is unstable and prone to data corruption.,4
It's a poorly designed piece of software.,Technical Problem,its a poorly designed piece of software.,4
My data has been lost due to a software malfunction.,Technical Problem,my data has been lost due to a software malfunction.,4
I regret purchasing this; it's a constant source of headaches.,Technical Problem,i regret purchasing this its a constant source of headaches.,4
"It constantly requires updates, yet the problems persist.",Technical Problem,"it constantly requires updates, yet the problems persist.",4
"The software is sluggish and unresponsive, even on a fast computer.",Technical Problem,"the software is sluggish and unresponsive, even on a fast computer.",4
The installation process was complicated and error-prone.,Technical Problem,the installation process was complicated and errorprone.,4
The customer support is unhelpful and lacks technical expertise.,Technical Problem,the customer support is unhelpful and lacks technical expertise.,4
The software is too complicated for its intended use.,Technical Problem,the software is too complicated for its intended use.,4
It's extremely difficult to troubleshoot issues.,Technical Problem,its extremely difficult to troubleshoot issues.,4
This is the most frustrating software I've ever used.,Technical Problem,this is the most frustrating software ive ever used.,4
I keep getting duplicate entries for no apparent reason.,Technical Problem,i keep getting duplicate entries for no apparent reason.,4
The software doesn't integrate well with other programs.,Technical Problem,the software doesnt integrate well with other programs.,4
It's a buggy mess that needs a complete rewrite.,Technical Problem,its a buggy mess that needs a complete rewrite.,4
The software is causing major disruptions to my workflow.,Technical Problem,the software is causing major disruptions to my workflow.,4
The login process is unreliable and frequently fails.,Technical Problem,the login process is unreliable and frequently fails.,4
The software needs a major update to fix its numerous bugs.,Technical Problem,the software needs a major update to fix its numerous bugs.,4
"I've submitted several bug reports, but nothing has been fixed.",Technical Problem,"ive submitted several bug reports, but nothing has been fixed.",4
It's consistently giving me the wrong results.,Technical Problem,its consistently giving me the wrong results.,4
The software crashes whenever I try to upload large files.,Technical Problem,the software crashes whenever i try to upload large files.,4
I'm constantly getting security warnings.,Technical Problem,im constantly getting security warnings.,4
The program is resource-hungry and slows down my whole system.,Technical Problem,the program is resourcehungry and slows down my whole system.,4
The interface is outdated and difficult to use.,Technical Problem,the interface is outdated and difficult to use.,4
It's very hard to find relevant help documentation.,Technical Problem,its very hard to find relevant help documentation.,4
The software is simply not fit for purpose.,Technical Problem,the software is simply not fit for purpose.,4
It's completely unreliable and often unusable.,Technical Problem,its completely unreliable and often unusable.,4
I've wasted countless hours trying to troubleshoot this software.,Technical Problem,ive wasted countless hours trying to troubleshoot this software.,4
The program's performance is unacceptable.,Technical Problem,the programs performance is unacceptable.,4
The software doesn't work as advertised.,Technical Problem,the software doesnt work as advertised.,4
I'm extremely disappointed with this purchase.,Technical Problem,im extremely disappointed with this purchase.,4
This software is a major productivity killer.,Technical Problem,this software is a major productivity killer.,4
The constant errors are seriously impacting my work.,Technical Problem,the constant errors are seriously impacting my work.,4
I've requested a refund due to the consistent technical issues.,Technical Problem,ive requested a refund due to the consistent technical issues.,4
It's far too buggy to be used in a professional environment.,Technical Problem,its far too buggy to be used in a professional environment.,4
The software is a constant source of frustration and stress.,Technical Problem,the software is a constant source of frustration and stress.,4
I've spent more time troubleshooting than actually using it.,Technical Problem,ive spent more time troubleshooting than actually using it.,4
The program is completely unreliable.,Technical Problem,the program is completely unreliable.,4
The frequent crashes are causing significant data loss.,Technical Problem,the frequent crashes are causing significant data loss.,4
This software has been nothing but trouble.,Technical Problem,this software has been nothing but trouble.,4
It’s a complete waste of my time and money.,Technical Problem,its a complete waste of my time and money.,4
The software simply doesn't work properly.,Technical Problem,the software simply doesnt work properly.,4
I am incredibly disappointed with the quality of this software.,Technical Problem,i am incredibly disappointed with the quality of this software.,4
It has caused me significant loss of productivity.,Technical Problem,it has caused me significant loss of productivity.,4
This is the worst business software I have ever used.,Technical Problem,this is the worst business software i have ever used.,4
It requires constant intervention to keep it running.,Technical Problem,it requires constant intervention to keep it running.,4
I wish I had never purchased this software.,Technical Problem,i wish i had never purchased this software.,4
The software is full of inconsistencies and errors.,Technical Problem,the software is full of inconsistencies and errors.,4
It's causing me significant problems at work.,Technical Problem,its causing me significant problems at work.,4
I regret buying this software; it’s utterly useless.,Technical Problem,i regret buying this software its utterly useless.,4
The support team is completely unhelpful.,Technical Problem,the support team is completely unhelpful.,4
"I've tried to troubleshoot the issues, but to no avail.",Technical Problem,"ive tried to troubleshoot the issues, but to no avail.",4
The software is just not worth the money.,Technical Problem,the software is just not worth the money.,4
It's constantly crashing and freezing.,Technical Problem,its constantly crashing and freezing.,4
I'm seriously considering switching to a different product.,Technical Problem,im seriously considering switching to a different product.,4
The bugs are so numerous they're hard to keep track of.,Technical Problem,the bugs are so numerous theyre hard to keep track of.,4
The software is a complete disaster.,Technical Problem,the software is a complete disaster.,4
